用户名,评论时间,评论内容,评分,赞同数
KLY,2022-08-15 23:05:08,15/8/2022 @ 英皇iSquare [hkiff]。劇本剪接大扣分，感情戲同探長戲嚴重割裂，另外一直進入唔到磊樂既角色世界，而南江又只不過係翁子光版的周慕雲…. btw美術演技都好睇，好耐冇睇過咁游刃有餘既偉仔，做正劇既許冠文好睇到想求多d戲份比佢🥺,30,43
丽地呼声,2023-02-12 12:59:40,2017年在同一家影院看了同样的题材《追龙》，那时候那部港片质量好，观赏性强，口碑好，但观众也并没有那么爆，如此优质的港片在大陆市场已经现出颓势，今天再次观影同样题材的《风再起时》有点苦涩，人少的可怜，港片在大陆已经回不到2013年开始的《澳门风云》横扫春节档的时候了，尽管每年都会有一部过硬港片在大陆上映，比如逆袭那年十一黄金档的《无双》还有《拆弹》系列、《怒火重案》但已经没有了轰动效应，这片子演员演技没问题，老戏骨许冠文、吴耀汉、太保这都是从港片的发迹和顶峰一路扛过来的，只是导演把这个片子拍的过于文艺，没有爆点，时长也过长了。新一代大陆观众对香港那段历史没兴趣，香港皇家警察、英式正步、绿军装、驻港英军、ICAC、女王照片、14K、新义安，对于那些没看过港片影碟的新一代观众都很陌生了,50,2
逆鳞莫触,2022-12-27 20:13:28,梁朝伟还是回家盯着刘嘉玲别总跟富豪爬山了，再爬下去真有孩子了,10,58
是王帅傅,2023-02-04 13:31:44,一次香港电影的华丽诈尸,40,47
慢点儿,2023-02-04 16:24:14,导演野心勃勃 又搞历史又搞王家卫 140分钟有点顶,30,29
鹰旗,2023-02-04 16:24:57,看过最难看的电影之一吧，碎片化，装逼化，无逻辑，充斥着廉价的质感，人生中的四十分钟就这么浪费了，好奇为什么我会在这里抗四十分钟,10,51
思路乐,2023-02-04 16:01:36,【C+】同样的碎片化叙事在《踏血寻梅》里是生效的，因为剪辑从头到尾都有非常清晰的道德指向，并一路裹挟观众冲向末路的死与新生。但在《风再起时》里，这种叙事又难以成立。枭雄式的时代剧必然是幌子，内在仍是近乎空荡的格调，竭尽全力用影调渲染所谓的“私人情绪”，可依旧是靠着演员魅力来粗暴取代角色的本真。香港电影对翁子光而言只是一道容器，在这个过程中他只是一昧向内倾泻自己对不同类型的喜好，并不断效仿王家卫的皮囊（绝对是刻意的，几乎未曾考虑任何血与肉的填充），与导演前作相比彻底堕落成了矫情的精美鸡肋。但仍然有非常精彩的局部——比如南江缓缓叙述自己在抗日战争中的往事，影像终于作用在了实处，光就这个段落已经足以秒杀《无名》全片。,30,11
🧹🐥💦,2023-02-04 16:22:31,导演你应该是在洗钱吧？不然我理解不了你在干嘛😄,10,37
DeckardYang,2023-02-04 16:11:12,【4】非常难得地沉住气去描摹人物与勾勒时代，泛黄的主题被翁子光找到了最温柔的口吻讲述，城市在他们的指缝和步伐中变迁。,40,21
撒野,2023-02-05 22:03:12,是翁子光把心掏出来写的给香港的情书。看的过程中你会想到你之前看过的跟香港有关的一切。张爱玲王家卫陈冠中银河映像的配乐还有那本写重庆大厦的非虚构文学。香港的前世今生如此复杂混乱却又如此迷人，只要还有一个人在夹缝中在商业化大浪潮里用这么浪漫又真诚的叙述去说这百年香港往事，它就不会死去。,50,29
山下猫,2023-02-04 13:35:50,每句台词切一个镜头，简直两个半小混剪短视频，观众难受不？莫说人物，连像样的情节都没，靠精装美术和数星星掩盖空虚。可别再拿粗剪6小时当卖点了，就是失控和浪费，大量演员被剪，镜头切快看不到口型。不少旧片手法，街头拉胡琴想黄飞鸿，社团摔粥碗想洪金宝摔汽水樽，连“她不是rachel ”都用了，我们港奴十级大考。翁子光个知识分子样，但骨子里性别意识是基本盘，把男凝当痴情，该不会觉得自己拍杜鹃有何过人之处吧？春夏这种“终陷淖泥中”的角色实则为自己开脱。口上说为下一代，其实是恨上一代得益者霸着不分给“下一代”，写给香港的情书，都是西关风月纸醉金迷，就知道是身恨生不逢时当不了p客。梁朝伟真稳，谭耀文戏碎仍有光。徐天佑演郭天王少年，唉，他这个年纪在上个时代应该是主角了,20,32
Wayne,2023-02-04 23:03:52,想来想去还是给个中间一点的分数吧，电影质感很好，整体表演也很耐看，但叙事技巧实在是不太高明。一个直叙的故事散架成这个样子，完全搞不懂翁的重心到底在哪里，是人物还是时代？一处接着一处的回忆拼图是没办法扣上整个叙事图景的，只有东倒西歪的分散与不完整，各式各样的MV叙事在氛围上是铺垫好了，但在整个结构上是糟糕的且重复的。我看不出它的侧重点，只看到零散的叙述和记录。,30,9
好运锂,2023-02-07 22:38:27,距标记超过五年doesn't seem like it！连看两部托尼主演，都是他自己玩剩下的音乐还特cheesy，风格割裂但是杜鹃竟然有些发挥空间,20,3
四季交易會,2022-08-15 22:33:27,去年hkiff也買了這場，所以如今期望落差更大了（。）流水帳敘事，什麼都丟鍋裏燴一盤，但很多沒必要的要素，尤其是感情線，最後出來節奏稀爛。其實看得出企圖模仿wkw，但……【杜鵑很美就是,30,38
Feifei Sun,2023-02-04 14:36:12,"我居然完全找不出亮点？？？
叙事上一塌糊涂，相当赶剧情以至于很多地方根本摸不到脑袋，整部片子下来连个故事我都记不住
剪辑也是惨不忍睹 使得叙事更加懊糟
女主角全程司马脸
两大影帝的演技也不是很走心，最牛逼的居然是客串的许冠文
导演真的是墨镜王的忠实铁粉 随处可见模仿《春光乍泄》《花样年华》的痕迹
爱情线占主线但是却如此俗套的三角恋 那句“明明生的是男孩，不是女孩，你却非要让他叫‘念瑜’”让我在影院笑了好久
真的是又臭又长啊 救命",20,47
南瓜不开花,2023-02-04 00:27:24,有野心，然神散，画面且精致，镜头很堆叠｜跨越40-80年代香港的时代更迭与人物变迁，可以讲得很好，但让步于“情诗般的文艺劲儿”，杂散碎片消解了叙事，不伦不类的香港往事里的花样年华,30,14
毛绒绒,2023-02-04 19:22:27,后半段渐入佳境，是近年来香港电影里最没有“北上”气质的一部。摄影很美，配上胶片感的粤语长片质地和丁可的配乐，两个半小时的“香港往事”在大银幕上像走马灯般贴面碾过，如同亲历，仅这一点，复古迷就已经值回票价。许多的慢镜头，反而让电影更像一个打碎的梦。杜鹃非常美，虽然仍是旗袍香风，仍是人面桃花的败去，但这一次我在功能型的花瓶女主身上，读到了一点生命力。是会想二刷的电影。,40,84
Peter Cat,2023-02-08 01:02:40,可翁子光又怎么不会迷失呢？面对这浩瀚的精美素材，面对着港片历史的层层重负，面对当下太多的非创作因素，茫然四顾，香港何以为之香港，好像不再是一个能提的问题，反倒是如何去担负，如何去消化，或者，历史从不接受发问，密涅瓦的猫头鹰只能在“黄昏”起飞，唯有承受，只能承受。《风再起时》就是这种承受。,40,27
鬈毛毛,2023-02-04 18:05:29,翁家卫的香港版《罗曼蒂克消亡史》。。。。。,20,28
小斑,2023-02-05 13:34:43,一星属于梁朝伟。这部电影讲的是香港变迁，那一代华人作为被殖民者的苦难、上进、变异和隐退。拍吕乐拍吴锡豪的电影不少，表面上枭雄乱战而背后有时代、ZZ和人情，哪怕做成纪录片也非常有娱乐性。这部电影用一种「消解」的角度呈现冲突，既没有高对抗也没有那么多江湖义理，而着眼在「人」和「情」上，拍得好了会很有意思。希望导演们还是克制一下自己的「文艺」泛滥，不是把时间线打碎加点光影加点慢镜就叫「诗意」，很有可能是MV。PS：以主线安排和头尾出场来说磊乐应该是第一主角但演着演着注意力更多会偏向南江……是我个人偏好导致的还是镜头真有那么爱梁朝伟？,40,13
匣中猫,2023-02-04 16:57:41,感觉像是要跟程耳争王家卫传人，但可惜看上去像是精致的短片集，每段摘出来都很好、都能看到出处，但链接性不够，有种吃乱序切件什锦寿司的感觉。不过确实是在香港商业片老是把雷洛跛豪拖出来嚼的当今环境下，拍出了一部不同于前辈们的香港往事，片中的所有人物都无法摆脱时代的影响，而大胆的杜撰对应上一些史实印记，将私人情绪融进时代浪潮里，很难不余韵悠长。但整体来说真的拍得不够好，呈现出一种文青拍不好大场面的感觉，但似乎再看到梁朝伟演同志……就有了一种原谅了导演镜头老是对准了杜鹃的腿耳环脸然后还要让她硬讲粤语的感觉。顺便演技这块基本无需多言，但除了演技、剧本之外，丁可绝妙的配乐也值得一切赞誉。3.5归4。,40,22
BLUE3rd,2022-08-18 09:14:35,翁导高水准纯港文艺片…好看…伟仔城城演技太棒…,50,64
荔枝超人,2023-02-04 21:35:52,优点和缺点都很明显，但是我选择支持！,40,10
游牧人·芳汀,2023-02-05 00:14:16,#电影院##粤语点映版#王家卫曾经对老年梁朝伟演艺形象的规划在别的导演身上得到了很好的实现,-t,8
文森特九六,2023-02-11 21:33:59,某些段落与这部两个多小时的编年史格格不入，例如许冠文那场精彩的英文陈述，纵然倘若试图在脑海中构建出更加庞大漫长的作品原貌则这类段落又的确是不可或缺的一环。历史风云与儿女情长间，无序中奔放，混乱中绚烂，漂泊却见洒脱，江湖更具人情，即便经历了主动与被动的取舍，一种不依附于任何意识形态的香港底色还是被翁子光提炼了出来——一座从未受到绝对的束缚但又从未实现绝对的自由的肆意之城，而《风再起时》这部献给这座城的电影本身又何尝没有经历着相同的感慨与叹息：破碎中圆梦，废墟中繁华。从王家卫到吴宇森，从一次动荡到一个时代，试图去记录和重现的翁子光，其动机已然不仅仅是出自影评人的本源行业身份，更是作为一个香港人的某种朴素、浪漫而执着的自觉。,40,10
JoeyLu陆柏宇,2023-02-04 12:38:38,节奏太拖，而且本以为是双雄对决，结果几乎没多少交集。,30,16
基瑞尔,2023-02-04 17:19:16,压片太久太久，但比想象中好点，还很容易找到让人喜欢的地方。只是即使有这么长，仍然会更人一种匆忙并且胡乱跳转的观感。看的时候遗憾是大于不满足的：如若真的放开了做，参考《苏里南》这样的“枭雄乱斗”尝试；借由流媒体作为推手，制作一部品质的迷你剧会如何？能否多少填补在各种电影已经写滥的聚焦之外，找到更为完整、从容以及个性的表达。Maggie、Ron还有金燕玲的部分，都是没有看够的；也好想知更多事件之下它的角度。[磊乐终了的阿扁广播，许冠文的惊鸿一瞥，没有“黑底白字”的教科书信息展示或许是最后的坚持],30,6
壹安²,2023-02-05 12:50:19,看懂了，英雄是时代「造」出来的，枭雄是时代「逼」出来的。原来香港可以是NYC的夜幕，也可以是LA的黄昏，但是更多的是他自己的结痂。梁朝伟弹琴郭富城跳舞场面足以留名，翁子光懂王家卫，但只懂他好看的外表。,40,11
泠鬼,2023-02-04 19:12:49,不知道还以为是王家卫拍的，既然要拍这种XX往事，干嘛不直接拉到四个小时呢,30,11
雁城,2023-02-04 12:58:15,有阵子没看过拍得这么乱的电影了，乱的不只是叙事的顺序，也是情绪、人物塑造和故事内核。在雷洛这个IP作品矩阵里，直给狗血程度不如《五亿探长》，粗砺原始cult不如《跛豪》，当然审美优于《追龙》，但不至于跟纯商业片比这个吧……时间跨度四十年，又要讲香港，又要讲多角色——参考《五亿探长》讲雷洛一个人的四十年都用了两部电影五六个小时的时间——《风再起时》的两个多小时从一开始就不可能够用，剩下来的片段也是支离破碎。没有佳章，佳句甚至也是寥寥。导演们千万不要觉得请了梁朝伟自己就是王家卫了。翁子光目前的功力，可能还是只够拍《踏血寻梅》这种更聚焦的故事。,20,42
阿树,2023-02-06 01:21:31,美術與佈景有大問題，影視城的感覺太強，年代戲裏面不應該顯得太「新」，尤其是城城與杜鵑雨中曲開始，影視城感覺非常明顯。另一層面則是剪接，感覺上有參考一代宗師，人物線前進到一個節點，開始不停的回溯，雖然明白這種處理的意義，是為了探究人物為何到這一步，但在觀感體驗的連結上確實碎，單個段落裏面人物的情緒是接得上的，例如磊的初戀往事，但到下一場情緒又丟了，結構問題很大。但依然推薦去影院觀看，因為有梁朝偉近幾年來最自如和有魅力的演出，南江與父親的支線有非常動人的地方，「槍」和「鋼琴」意象的運用，以及梁很多私人情感投射，在火燒鋼琴的戲裏，以及結婚超現實場景得到釋放。理解這套戲的入口，在「新移民」這個身份角度的切入，翁對傳統意義上的雙雄敘事確實不感興趣，通過磊與南兩位「新移民」講香港的吉光片羽才是他關心的,30,3
2M,2022-08-17 20:41:31,大气，对电影及审美的敬意尊重，对当代香港的情深义重，难道不应被定义为一部好电影？,50,43
一條魚佔滿了河,2023-02-04 17:23:36,★★☆ 呂變成磊，表達築起了牆，藍變成南，顏色即成方向。翁子光太貪了，刪改過後更讓故事如同流水賬一般，人物選擇與轉變的內心支撐都不夠，雙主角的各自視角沒能擰成一股，風格化與通俗化之間也彼此拉扯割裂，唯有水準在線的視聽語言讓電影不至於那麼難看。如果有機會，不如重剪一版迷你劇上海外流媒體吧，電影的篇幅講不完整這個故事。,20,19
高詩遠,2023-02-15 23:59:41,导演有极高的审美标准，无论是构图，配乐还是台词的设计等都能看出他精雕细琢的巧思以及对艺术的追求。相思情愫被嵌套进香港历史以及反贪任务之中，各角色随着时间的推进而水涨船高，也逐渐不敌现实而退出斗争舞台。黑白意味过去，争吵时才袒露婴儿的性别，剧终时才揭晓隐藏于内心的三角关系，种种尝试打破了平铺直叙的刻板手法，探索了镜头语言的新的可能性，可以说这的确是一部真正意义上的电影。但全程看下来能很明显地感觉到脑子过载，其中的设计是满到溢出的，无论是《教父》般浓重的史诗感，还是类型片的多样化尝试，都在间接让整部片子的节奏变得混乱，最基础的故事没讲好的结果是很多时候都不知下一秒的枪声究竟为何而开。郭富城的大肚腩很吸引人，胖嘟嘟的皮下不知深藏了多少的悲伤。,30,2
良夜不能留,2023-02-04 12:50:25,想拍大时代，却没有大事件，更别提具体的人。像是一盘散沙，没有抓取视点的慧眼，再抒情也不浪漫。@moma,20,32
脱氧核糖十三,2023-02-04 22:19:41,说是给香港的情书，但情书能不能也有个字数限制。仿佛既许诺了山盟海誓，又附上了银行流水，中间还夹着成本两块五的黑豹玩偶，看得人无所适从。通过不同视听形式塞满时代背景信息，艺术风格模仿痕迹明显地细描人物交织，加上风格鲜明又割裂的极致配乐… 翁子光想要的实在太多了。,20,11
西瓜好大,2023-02-04 22:06:35,好久没看到这么恶心的剧情了,10,31
绝望鸭脖,2023-01-16 14:43:55,从1940到2000，旧香港、日军、港英、黑社会、GMD、探长贪腐、全球通缉令等，风格独特，回味无穷…,40,34
瓦瓦,2023-02-04 15:45:54,果然是踏血寻梅的导演，整部片子腔调拉满！镜头配乐美轮美奂，大荧幕上特写脸毛孔都无比清晰，梁朝伟和郭富城真的完全不见老，两位大佬之间的权欲斗争，举手投足都是戏。近几年的香港电影逐渐模版化，《风再起时》如此风格化真的让人惊喜。,50,7
🌵🌵,2023-02-06 10:49:56,一个被拍了那么多遍的题材为何依然让现在的导演着迷，故事还能用什么方法去再现，是否与当下产生了新的共鸣，从这些角度来看大致方向是对的，选角用心良苦，浮光掠影淡去了江湖险恶，晕染城市的命途不定和起落无常，权利争斗落在了我们需要一个什么样的香港的诘问。乱七八糟但拍得确实好看，可惜散乱的素材在尚不具备大情节叙事能力的翁子光手中亦沦为了空泛的怀旧，千言万语最终只化作一声叹息。,30,4
叶飞Phoenix,2023-02-04 10:16:11,借由错乱、浪漫的个人故事讲述了荡气回肠的“香港往事”，展现了上世纪中叶动荡的香港历史，以及在大时代洪流下的个人命运沉浮。有潮起潮落的权术争斗，也有活色生香的情感纠葛。在时代的错乱中，磊乐与南江选择了不同的人生。事业线上，起起落落，终未如愿；情感线上，各自与初恋爱而不得，终与法妻相濡以沫。错综凌乱的剪辑给人一种强烈的缥缈感，暗示一个时代的随风而逝，和个人在时代洪流中的无足轻重。,40,7
维城乱马,2023-02-06 12:56:44,2023年，没想到还能一周内在影院看到两部梁朝伟的新片～,30,4
瓦瓦,2023-02-04 15:45:54,果然是踏血寻梅的导演，整部片子腔调拉满！镜头配乐美轮美奂，大荧幕上特写脸毛孔都无比清晰，梁朝伟和郭富城真的完全不见老，两位大佬之间的权欲斗争，举手投足都是戏。近几年的香港电影逐渐模版化，《风再起时》如此风格化真的让人惊喜。,50,7
🌵🌵,2023-02-06 10:49:56,一个被拍了那么多遍的题材为何依然让现在的导演着迷，故事还能用什么方法去再现，是否与当下产生了新的共鸣，从这些角度来看大致方向是对的，选角用心良苦，浮光掠影淡去了江湖险恶，晕染城市的命途不定和起落无常，权利争斗落在了我们需要一个什么样的香港的诘问。乱七八糟但拍得确实好看，可惜散乱的素材在尚不具备大情节叙事能力的翁子光手中亦沦为了空泛的怀旧，千言万语最终只化作一声叹息。,30,4
热情华夫饼,2023-02-07 14:36:11,郭富城致敬《黑豹》，梁朝伟致敬《困在时间里的父亲》。,20,7
游遍星辰,2023-02-05 08:44:08,俗套、男凝，给伟仔两星，真是好帅🤤,20,21
牛奶很忙,2023-02-04 22:12:09,只有小人物，没有大时代，有佳句无佳章，这么大野心还是被过多的元素扼杀了。如果拍成四小时的“香港往事”或者四集迷你剧就好了。,40,21
洋葱骑士,2023-02-04 19:49:38,有点失望，感情戏太多太俗拉低了观感。浪漫的手法弱化了枭雄片应该有的史诗气质，剧情有点散，人物关系几分无间道。郭富城在梁朝伟面前气质还是差了一点，梁朝伟一举一动都散发着一股无法抵御的魅力，对比之下郭富城饰演的磊乐还有点油腻。,20,21
小植野,2023-02-04 16:33:39,#1800标记，【B】剪辑给整个时代下被历史洪流裹挟着前进的故事注入了不少的活力，无论是双雄的对峙还是轻佻暧昧的异性情感，碎片化的叙事始终保持在服务于时代和历史，在人物的闪回中也能把握到共通的情绪，两位主角的回忆中，都同样有一股单纯的求生意志，又或是结尾点明的自我欺骗，不过是在混乱时代中给自己一个活下去的简单理由。,40,8
维城乱马,2023-02-06 12:56:44,2023年，没想到还能一周内在影院看到两部梁朝伟的新片～,30,4
毛炸完了,2023-02-04 16:19:30,？为什么要让我看140分钟的ppt,10,32
frozenmoon,2023-02-05 14:08:26,把人物和角色压扁、推远，把时代和背景居中、拉近，把原本应该当做叙事衬布的背景推成主角，所以这里的主角是那座城，那段时间，那几个时代，人变成了陪衬。这种拍法注定迎来分化的评价。这其中对于一些经典电影的致敬和摩挲，对导演来说或许重要，但对普通观众而言会觉得迷茫，对影迷型观众而言，又达不到什么特别的触动。从这故事里当然明白导演的野心，但这需要理性分析才能领会，而问题在于这是电影，而不是历史非虚构著作，这样的讲述方式，不太像作者和观众的对话，而有点像考验了。如果排序:配乐好于影像好于故事。,30,8
筵席之所,2023-02-04 20:30:10,大型三角恋广告爱情片（国语配音版请滚出电影院！）,30,20
韩松落,2023-02-04 22:00:25,在九十年代港片枭雄片留下的遗产基础上，另开格局，另赋情怀，探究了香港往事的另外一种色彩，和另外一种可能。避开了九十年代香通俗文艺的高度控制和戏剧化，更电影，更散文，也更罗曼蒂克。等到电影结束的时候，也终于让我们明白，所有的“往事”终究是一场开到荼蘼，一次又一次的开到荼蘼，看起来是指向过去，但实际上是留给未来的，未来的我们看今天，又何尝不是在一场花事之中。,40,7
飛了,2023-02-09 18:17:45,過於浪漫化了，但這又是香港電影黃金時代諸多作品最為突出的特點，華人探長的故事只是一具外殼，內裡是香港幾十年的滄桑變化。,40,1
松野空松,2023-02-03 22:18:55,7.3 大概是香港的《罗曼蒂克消亡史》吧，有很多无效的升格镜头，感觉有点想模仿王家卫，但王家卫的每次升格会让人感觉角色和环境融为一体，而翁子光这里像是掩饰自己调度上的无能，但你不看整体，看一些局部还是觉得很美好，特别是所有梁朝伟出场的地方，他在这里的状态太王家卫了,40,6
camera roll,2023-02-06 18:12:57,花樣年華 x La La Land x 反貪風暴 / 許冠文最後一段英文表演被吹得神乎其神的，抱著很大期待結果發現就這？這種話術國產劇一抓一大把，連我這種普通人都感動不了，難道還能感動英國高官？演的最好的是徐天佑，真沒想到他跟郭富城能這麼像，語氣和神態都還原了八九分。該如何評價女一號杜鵑呢，隨著人物年齡、身份、心境的變化，永遠都是一張沒有表情的poker face。,20,4
朱马查,2023-02-14 00:09:08,香港电影教科书……的目录（乱序版）。但是还是带着这么多“恐怕这个璀璨都市光辉到此”的厚重情感滤镜，竟然是在许冠文一段主旋律独白里升华的，太神奇了。（以及好久没看到这么帅的梁朝伟了！！！值得坐一个小时地铁去看全城唯一的粤语版）,30,2
阿西ash,2023-02-05 13:56:37,从未看过这么难看的电影。，折磨,10,21
余小岛,2023-02-04 15:03:27,深情款款，极大的叙事跨度和创作野心，朝着王家卫又进了一步。从四十年代香港沦陷一直拍到了新世纪初期，无关警匪、正义或邪恶，只是这座城市的沧桑变化。电影的最后，梁朝伟说人的一生都在演戏，郭富城看着电视上放的陈水扁受审判刑的新闻。历史由此衔接，时代的巨轮还在滚滚向前。140分钟完全不够，有太多的历史一瞥值得展开。,40,5
奥兰少,2023-02-06 19:17:08,快速剪辑、升格镜头叠加频繁闪回，仿佛保证细节的同时高效地拉伸了时间跨度和叙事容量，但落入每一个具体段落，却无不暴露讲述的浅薄急躁和情绪的虚浮造作。往事的厚重最终压平，王家卫样的风格望进去看不到一点深沉，一切不过浮光掠影。翻寻那半个世纪的纠缠背后，因果竟落到狗血情爱和比情爱更失真的战争创伤上。最好的竟是许冠文的英文演说，可惜这一段放入高度罗曼蒂克化的故事里，显得那么格格不入。,30,3
嫩只猪猪,2023-02-04 12:56:21,果然压了五年不是没有原因的，在影院如坐针毡。导演功力好差，别妄想拍出“香港往事”了。,10,38
紫苏,2023-02-06 14:43:34,翁子光既《踏血寻梅》之后的失望之作！为什么能用这么豪华的团队做出这么差的作品？还两个半小时……想学王家卫想学美国往事没关系，至少先创造一个让人产生共情的人物啊……观众到底为什么要看大腹便便油腻郭富城杀初恋哥哥，然后在正妻孕期出轨初恋平替莞莞类卿，搞黑帮业务能力为零，全靠正妻和正妻舔狗维护最后还善终啊？,20,7
陈婉雪⛄,2022-08-16 00:26:39,HKIFF 一般般 浪漫的历史戏但感觉没有主心骨剧情,30,33
Mumu,2023-02-04 15:54:41,不是感兴趣的题材，为了确认春夏还在去看的，+1星。,30,8
