用户名,评论时间,评论内容,评分,赞同数
Clyde,2023-02-09 20:42:48,好想看3个多小时的版本，就目前的版本而言，只能给三颗星，但该片的质量在林林总总的“四大探长”题材的影片中，大概仅次于《跛豪》。影片在商业上的失败，可能会导致很长一段时间都没有导演碰“四大探长”了，而这个题材，还缺少一部全景式的经典之作——不知道五小时版本能不能勉强扛起这面大旗？更不知道有生之年能否遇见更好的版本？如果素材足够，又有神级剪辑，该片也不是没有可能像《美国往事》那样成为再世经典。十余年前，翁子光还没有成为导演的时候，托冯宇的福，我便“认识”了他，这么多年，他一直在我的“朋友圈”里，看着他一步一步攒出了这部大制作，看着他的孩子成长，看着他变胖，但没想到还会看着他如此靠近王家卫。太怀旧的，太情调的，太香港的，可惜的是，看不到他的全部野心。,30,0
奇妙能力_,2023-02-04 20:12:54,虽然不至于睡着，但无语贯穿了看片始终。,20,14
j...oker,2023-02-07 22:31:17,"大杂烩风格、乱。想塞进去的东西太多了，每条线都舍不得丢。一些段落单独拎出来是美的，但是整体上不统一。HK首映见到了众主创，加一星！
（拍的时候应该很废烟吧）",40,1
姜大师,2023-02-03 21:53:53,你自己康康你拍的什么,30,10
我情绪零碎KAI,2023-02-05 19:28:20,"翁子光是有野心的，奈何太想要还原一段香港史诗却步步走错。镜头炫技成分大过实用性，表演无法搭建同频的磁场，剪辑不肯取舍拖累有效的叙事，最终在抵达观众的每一步上置屏设障。纵使理解于剧情遭删减的困难，也摇头于两个半小时信息量有限的窘境。
同样的镜头语言，在墨镜手里是让渡想象的空间，是留白。在翁子光这里成了文本单薄的遮羞布，他试图以此弥补演员表演上的缺陷，但最后稳定输出的只是一张张偷师王家卫的静态截图。",20,5
小山生桂枝,2023-04-14 23:04:54,有佳句而无佳篇。导演应该觉得自己拍了这么多素材特别厉害，必须全部塞进电影吧，乱死了……不过梁朝伟还是那么好。2月15日观影,30,0
Dgnic_,2023-02-05 00:23:31,也许是审核压力，也许是剪辑目的，不管怎样，《风再起时》最终呈现的是一个完全失序的叙事，在其所持有的鲜明主题与激烈矛盾下，这如同醉汉般东一榔头西一棒子的讲故事方式，不仅让它没能拥有王家卫电影似的碎片趣味，更让整部电影显得是如此地难以沉浸——哪怕其中有几段拎出来看是有点意思，但顺着看却一点没有这样的感觉，只剩下找不到重点、摸不清整体，以及晕头乱向。两个男主人公的人物弧光和路线之争好像本是影片的重点着力之处，可最后无论变质还是分歧，都只被消弭在看似风起云涌的历史中，变得琐碎而孤立，仿佛邻居家什么鸡毛蒜皮事，时时带着几分难以忍受的聒噪。而在这样的叙事表现下，电影再怎么去努力强化自身的电影感，去雕琢每个片段的构图、光影、空镜，观众能感受到的，依旧只能是那阵没搔到痒处的难熬。,20,9
黑骨精,2023-02-05 11:40:27,老饭新炒，好题材也经不住反复折腾。导演极力呈现了史诗下的香港，但明显故事并没有凿实，观感也是支离破碎的。,20,3
usual,2023-02-04 21:30:54,静下心来好好讲故事那么难吗 不用虚晃无意义的象征镜头那么难吗 不用莫名其妙风格吊诡的bgm那么难吗 不用各种烂大街的故事人物梗那么难吗 全程没有重点拼接起来的烂片 恭喜梁朝伟新晋为烂片之王,10,19
影视爱好者,2023-01-27 15:18:13,被雪藏了这么久的片子终于得见天日。卡司一流，与大多数港片风格不同，带有浪漫和年代气息。梁朝伟很有魅力。,50,13
Jacques,2023-02-11 14:19:50,一半的美国往事吧。应该出导演剪辑版,40,0
梁威是条狗,2023-02-03 23:11:12,在英治香港黑暗时代互相扶持互相暗斗的双雄故事。尽量五亿探长这个相关题材已经有很多的影视作品，但这部影片还是用很新颖的视角带来更立体的人物、更新鲜的隐秘内容。比如五亿探长、抗日战争这两个看起来毫无联系的关键词，竟然是和剧情紧密关联的。同时两个角色有很强的对比，梁朝伟的南江内敛、不露锋芒、不怒自威，郭富城饰演的磊乐外放、锋芒毕露、霸道独行，梁朝伟的角色心理更加复杂，表演也更有层次感。南江的无厘头绰号恰是对角色很好的总结，看似很跳脱的举动，其实由人物成长经历和内心动机触发的。另外，杜鹃的造型和相貌确实很有年代感，春夏出演翁子光导演两部戏都是很让人惋惜的下场啊。,40,8
touya,2023-02-04 19:38:25,点映场，公映许可显示2020年，三年里不知道翁导到底改动了多少内容，但我相信整部片子的气质应该是不变的。一部文艺向的枭雄片，没有火爆的枪战，反倒聚焦在儿女情长上，有几幕实在太王家卫了，重感受而非更充实的内容。借吕乐蓝刚两人的成长轨迹放眼几十年香港沉浮，可以说是柔情，也可以说不够厚重，突如其来的歌舞片段落直接把我看无语了……这一出罗曼史倒是非常彰显演员魅力，但镜头剪得太碎剧情一会儿赶一会儿散，始终没有提起气来。时代造人，人也引领时代，功过是非在这部片里似乎从不重要。话说谁能告诉我张兆辉在片子里到底演那个角色啊？,30,1
乌鸦火堂,2023-02-05 13:31:25,"翁子光野心非常大，我猜他是要拍港版《美国往事》。但效果一言难尽，历史厚重、镜头调度、光影细节和演员表演极佳，组合在一起就变成PPT，要不是画面和演员都撑不下去。

翁子光肯定是要打造严肃史诗的，但浪漫主义和江湖兄弟情的塑造，又是枭雄片的做法。与其埋怨审查，倒不如说导演创作受到投资方的干扰，这么大投资的电影肯定要为市场考虑，导致电影风格一会儿王家卫，一会儿吴宇森，也使该片成为打算走历史史诗路线却又巴望着娱乐效果的四不像。如果存在4个小时完整版的话，那时候再说。

许冠文和谭耀文最佳，谢君豪版跛豪，形象和气质都不符。而何启南饰演那位组建足球队的警长曾世荣，原型就是曾志伟的老爸。国语版给梁朝伟配音的竟然是祖峰，",30,8
macca,2023-02-04 21:34:57,原來蔡真才是真正贏家，有智慧，有手腕，還得到了兩個帥哥。,40,1
深夜声噎,2023-02-04 13:27:40,很浪漫主义，经过几年搁置拖延和不知发生什么质感也保留得不错，看出来在南海影视城拍的啦啦land了，十五蚊早场@佛老汇好抵睇，老伙计的配乐一如既往棒，好几个镜头惊艳到，春夏还在真好，豪哥的坡豪太可了但戏份少得让人愤愤，最惨是定格脸杜鹃小姐风上映时已经过气好几年。总而言之后面的风没敢blow起来可惜。迟到十分钟，黑白鬼子还在年代快结束坐下，等二白给我复述了。,40,5
-imparatruder-,2023-02-04 14:08:58,香港的罗曼蒂克消亡史，历史歌舞爱情黑帮警匪，多类型混合，中间还夹杂了一段主旋律独白，还有多处迷影桥段，使得这么长的电影并不觉得太疲倦。梁朝伟认真演戏还是非常抓人的，尤其喜欢他和杜鹃的戏。塞入了雨中曲、lalaland、花样年华、无间道、vertigo…,40,4
Dear Cosmos,2023-02-08 14:04:03,仿佛误入一场家宴，无动于衷地看着他人的家庭录像带，迷影与历史情怀的喷薄都过于私人，即使观众能够识别这是导演有意为之，也很难吃得消这么短平快的符号化叙事，加之时间跨度和叙事体量，整体的观感像是数十个mv串烧，而在不可抗力的影响下，全片最长的一个镜头竟是许冠文在廉政公署发表扫黑宣言大表忠心！我不知道翁子光是否在有意调侃港片的叙事，他将男主角的一切行动都简化为“为情所困”，双雄模式快演变成“双雄性模式”了，就连致敬《花样年华》的片段也变得俗艳难忍。以回忆为唯一驱动力的倒叙则是把冰山原则颠倒过来，让观众难以相信眼前的人物（因为你不知道他下一秒又会掏出怎样的秘密），甚至难以相信他们所处的整个年代以及整部电影——或许这弥漫的虚假才是导演的目的？那让人动容就不再是情怀，而是彻底的无奈。,20,4
芝士汉堡.,2023-02-05 00:50:27,【3.5+】一段历史洪流的浮沉往事摊开柔与刚的情绪纠缠，迷醉诱人的文艺气质把我们丢入那个繁荣鼎盛的港影世界，看残酷战火中依旧坚挺的血肉之诗，看纸醉金迷里权欲盛典的狂热浪潮，看枭雄联手的发家传奇，看惺惺相惜背后的心有罅隙，看隐入时代的悲情如何泛出泪花，看梦魇裹挟的真相道出藏匿内心痛的因果，看成全与退场收束的坦然化为作别的灰烬，不过都是为乱世求得的一份安稳，不过都是记忆洒落的浮光掠影，缺点和《无名》相当，但已足够好看……,40,3
爱笑男孩杰乌索,2023-02-05 17:18:15,"一直把片名《风再起时》，看成《风云再起》。
翁子光不想复刻《五亿探长雷洛传》的雷洛个人崛起故事，而是想拍成一个文艺范的《香港往事》。
然而，却拍成了一个两个多小时的超长MV，故事想一出是一出，节奏也放弃了流畅性。虽然有很多国产片里罕见的历史事件，却没有横跨四十年的史诗感，反而是有一股浓浓的劣质MV感。
与其看这个，不如去看那两部《五亿探长雷洛传》，并且那里面第二部也有郭富城。",20,4
Andy Dufresne,2023-02-05 00:13:21,"6-
泛滥的慢镜头不但没有给电影制造如《花样年华》般的情绪氛围，反而颇具mv的廉价感。戏眼在郭富城身上，但是这个角色的印象除了洗黑钱and老婆上位菀菀类卿等俗套梗，别无新意。反倒是丑造型的梁朝伟在某些时刻，别有一番风味。",20,11
Vincent,2023-02-04 17:02:44,香港电影烂到这种程度是没想到的。,10,25
zxy,2023-02-04 21:23:42,都什么年代了还拍这么恶心人的船戏，挺着快怀孕的肚子油腻的要死，给我来个王一博至少都比这清爽点,10,14
风过无痕,2023-02-03 22:11:56,春节后第一场不散。怎么说呢，这部剧没有港片之前常用的快节奏，多反转，充斥着各种慢动作。该片只把廉政公署成立的原因进行了年度梳理，剧情上无任何波澜，只是平铺直叙。郭富城，梁朝伟莫名其妙的在钢琴曲bgm后，和解，不知道之前矛盾的铺设为何意。,20,16
超人叔叔,2023-02-04 20:56:19,开篇给了一些期待 如果只半程结束的话倒是能接受 港警作风还真是五十年不变 可惜没法再大胆点影射了,20,6
鹅岭懒人,2023-02-07 21:14:51,三星半。跳票太久的电影，去看的时候怀着见旧友的心情。翁子光很浪漫，但那不是糖水式的浪漫，浪漫若与残酷无关，那便不是值得回味的情愫。,40,2
晚不安,2023-02-07 19:32:50,时间跨度长达三十多年，试图与香港历史（包括影史）对话，但叙事能力完全匹配不上叙事野心，所谓“香港往事”扁平得如同剧情大纲。用《花样年华》《春光乍泄》的方式拍雷洛探长和跛豪的故事，影像上极致雕琢，但剪辑明显没沉住气，只有造型，不见情绪。浓墨重彩的都是感情戏，而双雄对峙没有足够的张力，故事线头凌乱得散落各处，唯独不见对两人关系的准确刻画。能看出导演对香港的人事物都充满了感情，但这次影像上的豪赌无疑以失败告终。当回忆走向奢侈，也就可能变得愈发黯淡。,20,5
