用户名,评论时间,评论内容,评分,赞同数
冬季向日葵,2023-02-05 18:32:09,有意思的是，所有的男女之间都没有CP感，没有深情，只有南江（梁朝伟）与磊乐（郭富城）最是深情。当然，这不是关于爱情的电影，这是有关那段“至暗时刻”，是严肃的。又，每一个瞬间都很美，放一起看，却七零八散，似写一首诗，哪里被卡住了。翁子光，也不是王家卫。,40,2
昆仑有人衣青衣,2023-02-05 13:38:39,三星半。虽然仍然是四大探长的故事，但翁子光对于人物的处理跟以往同主题影片大不相同。磊乐和南江的转变，既有时代的推动，也有大环境的影响，由白向黑的过渡理由更充分。在表演上，虽然两人都是影帝，但差别显而易见。,40,6
森林~Alice,2022-12-05 16:55:02,以前的四大探长故事都是典型的“男人戏”，而《风再起时》中的女性角色不再是衬托探长的点缀，她们聪明有头脑，坚强有韧性，这段港史传奇也因此增添了浪漫唯美的意味。,50,31
seamouse,2023-02-05 00:51:00,"边陲县城看完，怎么又是那么长?之前扫了几眼一些群聊，以为春夏戏份都被删尽，没想到还闪回那么多，演职员信息也都在啊，是我没看聊天前后文?
感觉跛豪和雷老五的故事再拍下去，也快小丑蝙蝠侠宇宙了。当然翁子光这次为了抒发城市断代情诗，加入了南江这个绝对主角。也更像是变着花样证明，什么类型都能拍，以及王家卫和王晶之间本来没有距离。也就更不在意观众接受度了吧。
最喜欢偏后面一点一段小提琴作伴奏的indie rock，谁知道是啥",30,5
岬,2023-02-06 18:07:03,两个半小时，（摸不清主线的）男人的romance，要我老命。为了看望遥远青春期时的爱豆（的那星星点点分散的戏份），我付出了太多。,10,8
死亡食社,2023-02-04 00:00:00,属于观影过程中表演、镜头、年代感确实很有“港味”和沉浸感、每个部分单看都好得不行，余下就是历史事件的堆砌、历史人物的你方唱罢我登场，末了无法细究，如我看到疑似致敬《雨中曲》片段那种惊喜却摸不着头脑的感觉。格局和野心很大但时代戏甚至不如感情戏令我印象深刻，综合《踏血》感觉导演还是更擅长类型片,30,11
誒嘿嘿教主,2023-02-03 23:46:13,惊喜之作！时空穿越机一样，进入到一个混沌的，过足眼瘾的，梦一样的香港。最惊喜的是人设，郭富城的磊乐实在是太狠了，别人玩钱玩枪玩性，磊乐玩人。太适合大银幕了，进影院不亏！,50,13
曼仔,2023-02-07 00:15:38,和美丽友邻一起看的，电影支离破碎，但友邻好迷人，于是我的观影体验竟然很不错。杜鹃好美，但她的故事感做模特够用，做女演员则差很多，杜鹃身上有一种独特的神秘感，那就是虽然神秘，但令人毫无好奇。郭富城不知道在干嘛。梁朝伟迷人是迷人的，但哪里像个副手，大佬感不要太强好吗。,-t,2
克雷蒙,2023-02-04 19:40:06,港式斯科塞斯wannabe反腐倡廉电影。想拍好香港电影，熟练掌握好两个七，一个九七，一个六七。,30,4
墨江仙,2023-02-04 12:40:45,烟蒂砸落在地，激起一阵小型烟火。,40,25
渡渡鸟饲养员,2023-02-05 21:23:33,导演真的会拍电影吗!致敬也不是这么个致敬法啊。,20,8
仲夏之门,2023-02-05 01:38:38,对海量历史细节的照应和还原，的确意在强调上世纪HK的风云涌动，也无形抬高了观影门槛。但翁子光的二手文艺情调，混在片中着实碍眼，仿佛一厢情愿地扎入到怀旧滤镜中。连带双男主身上本该锋锐的枭雄气质，都被那股贯穿始终、撰写回忆录般的暮气给褫夺了不少，像是站在漂亮的布景板前，尽职完成各自的任务而已。如此在伪流水传记和风格化间两不靠的作品，留下的只能是一些精巧的残片，比如南江烧钢琴，还有那场贫民窟的枪战，背后的影像构思却又是如此混乱，始终差口气来盘活。,20,6
裕樹 です,2023-02-04 23:10:42,看时代，看人生，看爱情。感动在南江对妻子的告白“孩子是上天的恩赐，你才是我选的”，两段感情线完美融入进香港历史的演化中，看完对香港这座城市的好感猛增，梁郭对时代和人物的演绎真的是发挥到了极致。,50,23
JrFish,2023-02-04 17:02:09,全方位的灾难,10,41
武侠小王子,2023-02-05 15:41:45,补足了花样年华所有的缺憾，男人的战争竟可以如此浪漫。,50,1
Black sheep；,2023-02-04 19:51:32,"看得想走。很没意思，剪辑又烂还要拙劣模仿下王家卫（还搞这么多凹造型的升格镜头）。杜鹃这样的模特（最差劲的那类演员）为什么老有这么多戏拍，她的段落也基本都拍得像广告片一样。
整个片子混乱杂糅、情假戏也假，言之无物又故作感怀，浪费时间。",10,22
阿撇,2023-02-05 14:54:58,也是难得，全程边看边想问：这什么玩意儿？你说他烂吧，单独拿一段出来无论表演、运镜服道化和配乐都可圈可点，可放在一起就是满脑袋问号：这什么玩意儿？？？想表现香港几十年的历史，结果主线都淹没了成了一盘散沙。像把几个不同的文艺片、黑帮片、战争片、反腐片、歌舞片食材每个剪一点放在一个菜篮子里，没有任何烹饪。导致你看到里面演员表演得那么好都有点于心不忍，想跟他们说别这么认真了，这片不值得。冲着这几年最帅的梁朝伟，多加一星吧。,30,11
V五霸气不解释,2023-02-04 15:53:39,浪费时间。不伦不类,10,28
巴塔森梨,2023-02-03 22:51:45,2.3粤语版点映 | 三星半。一段上世纪香港的历史往事，暴力与贪污在街头巷尾的每个角落滋长，生与死，爱与恨，白月光与红玫瑰，执着与贪念，富贵与苦难，每个人都身处淤泥中无法控制地下陷，原本的纯洁与坚持开始变得亦正亦邪，但落满尘埃的善在最后也被拷问出一份洁白来。能看出导演想要拍出“香港往事”的野心，偏艺术化的剪辑风格与镜头语言都有精心设计，只是内容有些满溢，容易有大杂烩的凌乱感。两大影帝的飙戏很精彩，伟仔一如既往充满魅力，杜鹃的镜头有致敬王家卫的意味，很美，可惜演技有待提高；而春夏更像一阵风，短暂地惊鸿一瞥，带不走，留不住。,30,7
内陆飞鱼,2023-02-06 12:18:51,"“山川载不动太多悲哀
岁月禁不起太长的等待
春花最爱向风中摇摆
黄沙偏要将痴和怨掩埋
一世的聪明 情愿糊涂
一身的遭遇 向谁诉
爱到不能爱 聚到终须散
繁华过后成一梦啊……”",40,8
章赳赳,2023-02-04 21:45:31,ex司投资的电影，对，就这样,30,4
广末凉爽,2023-02-05 06:14:53,什么都想要，但是什么都说不好。143分钟的时间里又要拍双雄，又要拍时代，又要人物纠葛，又要命运纷争，头头不到岸。四大探长的故事用「花样年华」的调性来拍摄，文艺而且有新意，但是效果并不好，稀碎的剪辑和剧情都减分不少。多给一星给梁朝伟和郭富城，两位主演在银幕上魅力十足，要是换了其他人这片子更加没法看下去。,30,5
米格,2023-02-07 23:13:23,HKIFF 46｜我睇咗啲乜_嘢｜鏡頭很美，場景很美，表演很美，但全是mood shot，剪在一起節奏混亂到根本不知道想說什麼，莫名其妙的旁白和字幕又到底是在幹什麼⋯⋯好像看了兩個半鐘的廣告/MV｜杜鵑的故事告訴我們：應該選聰明人而不是會跳舞的｜片頭片尾可以剪成ICAC宣傳片｜故事和台詞老套到極點｜浪費錢和演員,20,2
掉线,2023-03-09 17:53:13,【C-】新片场广告导演作品合集。蒙太奇和旁白数量多的令人发指，影厅里的我仿佛是角色们的心理医生，因为他们每隔五分钟就要以第一人称向我吐槽他们的心事。时代感全建立在琐碎的情绪呢喃中，仿佛背后坐着安妮宝贝试图在仿写美国往事，当然，不是没有单纯呢喃也能好看的电影，比如王家卫，但王家卫是有水平的呢喃，是真正的金言妙句，而不是这种水平接近于最小说读者在高二时发表的QQ空间广播台词。兼具了男性视角的腐朽与反男性叙事的矫情，不可谓不集大成。,20,1
kylegun,2023-02-22 01:24:04,那一厢郭天王跳完雨中曲，这一厢来个日据时代黑白《钢琴师》，小朋友走过楼宇间驳火光影，洪兴祖师爷刚从西关过场子来讨生活就遭嘴炮围捕，杜鹃负责四处刷存在感名曰讲数替老公弄脏双手……翁子光迷影大拼贴，看得出诚意，但那么一本正经的乱来，短板毕露,20,1
由迦可汗,2023-02-03 21:52:53,上个世纪殖民地时期的香港非常混乱，结尾廉政公署的讲话说明了政府廉洁的重要性，影帝的飙戏是个极致的享受。,30,8
SuiKa,2023-02-05 12:21:08,文艺、商业的杂糅且集大成之作，可以看到非常多经典电影的影子，但是抄得很精彩，翁子光的剪辑、导演与编剧功力都展露无遗，特别是郭富城与春夏的闪回简直可以算是年度调度与剪辑。可惜结尾泄了气，杜鹃的演技也是一个遗憾的点，除此以外，已经可以算是香港电影近年来少有的精彩作品了。4.5星。,40,7
啊砸,2023-02-06 22:11:40,受欢迎无非就是题材的稀缺性，但完成度真的很差。大杂烩，好几处剧情设计白眼翻上天，一会吴宇森一会王家卫，一会说贪污一会说三角恋，企图还要把香港的历史拉进来，结果就是个缝合怪，别拍电影了，不如写论文好了。,20,3
snoopynirvana,2023-02-04 14:54:31,多一颗星给梁先生。感觉宣发要背锅...,40,4
Xaviera,2023-02-23 18:22:26,看的时候两种情绪：（激动版）梁朝伟真TM帅啊！戴眼镜真的好帅啊！抽烟就更帅了！弹钢琴也超级帅！跳舞也很帅！哭起来怎么也那么好看呢！（冷静版）王家卫怎么到处都是你？让杜鹃仿张曼玉我真的谢谢你！别拍感情戏了头疼！潮汕话也有点头疼。走着走着跳舞知道你是要干嘛了别了吧！导演估计自己拍得很开心把什么都“致敬”了一遍，建议放出3小时以上的版本或者真的搞成剧吧。实际上，看到最后真的很怕梁朝伟拉着孙子，突然孙子滚了一个橙，然后梁朝伟倒下（是的《教父》了谢谢）脏话都快到嘴边了的，它又给了我一排王家卫的字幕……,30,0
13号人间观察员,2023-02-07 14:20:34,没想到《风再起时》会被骂成这样。好吧，我还是见识少了，或者还是活在自己的同温层里吧。伴随香港流行文化长大的我们这代人，谁能不缅怀黄金时代的东方之珠、唏嘘今日这座城的衰败呢。《风再起时》的意义就在于，之前不会有人这么拍香港，在此之后，这种电影估计也再不会有了。,40,4
明日香,2022-08-15 23:41:25,HKIFF46開幕片。論坐在IMAX廳第二排看一個143分鐘的音樂MV是什麼體驗，literally只能看見各位主角懟到我眼前的毛孔，以及各種不明所以的慢鏡，慢鏡，還是慢鏡。本人脖子抬得頸椎病發作都看不清人臉，連郭富城後來那個情人是不是春夏演的都沒看出來，想罵人。丁可的音樂還是不錯。,-t,11
朱熠,2023-02-05 17:29:28,毫无节制地抒情，如坐针毡地看完，都佩服自己的毅力,20,5
肉馒头君,2023-02-03 22:34:21,刚从电影院出来，我可以很负责任的告诉大家，这绝对是一部很好看的香港犯罪大片，翁子光真的是中国少有的同时兼具商业性和作者性的导演，很有深度。梁朝伟郭富城都稳得批，杜鹃没想到啊，疯批阴郁又变态。强烈推荐大家都去看看，无名真的是近年来少有的不容错过的好片子!,50,17
冰块队长,2023-02-04 00:57:15,翁子光显然还是适合聚焦小个体与情感而不是大人物与时代变革。青年导演定要节制，无休止的致敬会使电影变成四不像，花样年华、千禧曼波、雨中曲。。而且整体太冗长。亮点还是碎片化的人物塑造，小瑜、蔡真等等，再次慨叹金燕玲女士，看她表演每一秒都是享受。,30,6
大浩Colen,2023-02-04 15:34:23,低吟浅唱的音乐、揭示悬念的闪回、仰拍脚步的慢镜、烟头灼烧的特写、诗意十足的台词、适时而变的画幅……要素齐全，文艺腔调过浓，但叙事破碎，时间线混乱，缺少印象深刻的记忆点，想要的太多反而竹篮打水，如同一本寡淡的流水账。和《狂飙》相比还差十个《无名》，没能抓住春节档的余晖。,30,9
把噗,2023-02-04 15:35:19,既要历史厚度，又要人物深度，既要内讧，又无胜负。太有野心，太满，也太凌乱。,30,2
小浩纸,2023-02-17 18:25:03,又一部属于电影院的电影。视听是我的菜，最喜欢春夏那段，梁朝伟我的神，但确实整体像被剪的混乱不堪的初版美国往事的香港再现。真的希望未来能有完整加长版。,30,2
redhousepainter,2023-02-05 20:21:57,春节刚在无名中听了梁朝伟的原音，这回听祖峰的配音还是需要切换一下。梁朝伟又演了一次花样年华，郭富城拍了雨中曲的短视频，祝福香港还有能过得下去的未来。,30,1
苏乏,2023-02-04 23:26:00,有几场戏印象很深，比如拾阶落座、捉蟹堵口，看过巷陌两名男主第一次立场鲜明的对抗，再去回味牌局上第一次指桑骂槐的争吵，的确别有另一重况味，原来前者当街虽为“同一底线”而搁置分歧，但二人均已无路可退，而后者看似咄咄逼人，但矛头最终指向的却并非彼此，非但没有伤及根本，反倒是映衬二人骨子里的默契，另外值得一提的是对女性角色悲剧性的诠释，以蔡真为线索，在小燕时崩坏，真正将两名男主联系在一起的，是这场悸动于小瑜、安放于Cora的情感流局,-t,4
Virgohi21,2023-02-04 23:42:53,混着迷影碎片的港式枭雄新酿与2017年的梁朝伟一样令人重新心动——还得香港导演才能拍出最有魅力的港星。其实用一部电影时长讲述香港的30年明显局促，但快速蒙太奇与缓步抒情之节奏张弛，次要群像与大量信息之取舍，画幅比甚至摄影风格之频繁转换反而更加凸显了作者意志。翁子光导演还是一位浪漫主义者啊。2018年曾在合作公司偶然得看一些片段之后一直念念不忘，今天看144分钟只觉得不够，特别希望有朝一日能看到4小时的版本。,40,3
汪金卫,2023-02-18 18:35:09,大陆公映粤语版。“四大探长”的故事被拍过无数次，这回在翁子光与如此豪华班底主创的演绎下，最终呈现的成片有基础水准不至崩塌，但也确实令人失望。首先这个跨越香港数十年历史，涉及众多重要角色的故事框架过大，影片又选择了多线索、插叙闪回的叙事手法，区区140分钟的体量难以承载庞大的野心。国歌国旗段落的保留还蛮珍贵的。最大的问题是类型不统一。日治香港时期的黑白残酷现实风格（这段很好）、郭富城杜鹃恋爱段落的歌舞片风格（莫名其妙）、动作戏的类王晶商业片风格、以及诗意浪漫加字幕卡类王家卫风格，四种类型拧巴地交替剪辑混搭成乱成一片的四不像风格。尤其是歌舞段落不伦不类，突兀出戏。浪费演员表演，更浪费对香港历史的一腔情怀。遗憾。两星半,30,0
影君子,2023-02-03 22:41:12,导演说这是一部献给香港的情书，从香港大探的自传讲述整个香港历史变迁，导演用各种超级大特写拍男神和女神，再加上IMAX激光厅各个毛孔看的清清楚楚，这完全是导演给粉丝福利...,40,13
柯诺,2023-02-05 18:55:58,翁子光的《一代宗师》。在香港枭雄传记片类型里，拍王家卫式爱而不得的影调和语调，拍流动细碎的香港往事，完全颠覆。它不是由多个主体情节扎实构成的，而是充满离散的片段、独白，闪回又退回的记忆体结构。存在要得过多，叙事断裂，磊乐和南江为何决裂也没有交代明晰等问题。相比这些，电影最珍贵的是拍出了香港这片浮城之地的困惑——磊乐和南江都潜藏着一段在抗日战争时的创伤，14K的来与走，闹与合，都有着关乎历史与身份的指涉。我想这也是为什么电影多次拍到脚和腿部的特写——起舞的男人，高跟阔步的女人，持枪大步行走在火拼场面里的小孩，这片土地上应该站着什么人，从上一代到下一代，这是电影最想问的，也是在整场对双雄崇拜式的史诗回眸和ICAC正确演讲的高光尾声之间，无法回答的。,40,3
要丸,2023-02-13 23:30:11,凌而不乱！在快速剪辑的时空旅行中感受风云变幻，能把时间跨度那么大的戏讲清楚讲明白，还融入如此多样的影像风格，真是荡气回肠。大时代小人物，被吐槽最多的儿女情长恰是我心中能称之为“史诗”的重量，鲜活的市井与人物离不开缠绵暧昧的情。程耳真的应该进来学学，同样是有格调的摄影，为什么他呈现出来是死的，而这部是活的。,40,2
小煎,2023-02-05 13:18:42,元宵音乐会,30,5
如水,2023-02-05 12:31:50,以人物成长串讲香港历史，知难为而为，加分,50,13
🫠,2023-02-13 12:53:42,"2.4 全剧6个女人：
1️⃣蔡真，工具人属性，没有独立故事线，随着磊的状态变化而变化，为其擦屁股决定出卖身体给南
2️⃣小瑜，救了磊命和其相爱。个人命运的悲剧以及整个角色充满了恶意，慰安妇后死于梅毒……可笑最后成为磊白月光
3️⃣小燕，无依靠的歌女因和磊白月光神似成为替身被“救赎”，全片女演员牺牲众多满足磊的性欲展现和挣扎，后死于生育（死前名句：“我以为她（男主1妻子）没能给你的（生一个女儿）我能给你。”）
4️⃣Cora，南的妻子，出场时间短仅配合南完满的人生，角色名句：“我不是她。”
5️⃣磊杏华，磊的姑妈，在其发达后过上好日子，形象贪婪小市民（出现戏份皆与男主1有关，无独立逻辑）6️⃣跛豪的太太（印象中没有名字？）和蔡真有一场对手戏，没有具体人物形象，妻凭夫贵",10,8
心想是城,2023-02-05 17:54:13,这才叫做良心之作！这是香港版的教父、香港版的美国往事！这才叫做真正的电影！人文、艺术、传奇、历史、巨制…风再起时真的太棒了！翁导的世界是极具情怀的，想象世界是深刻的，枭雄犯罪片拍出了文艺境界，画面极具美感、故事架构清晰、双雄回忆推动剧情、历史场景巨制、郭富城梁朝伟演技精湛造型突出，尤其是郭富城的磊乐，四大探长之首的传奇枭雄，这张经过雕刻般的脸，演活了喜怒无常，嬉笑于外表、隐藏于内心！梁朝伟一如既往的内敛和隐忍，梁朝伟的笑始终是那么的让人记忆深刻！,50,5
放开那个浪味仙,2023-02-07 10:26:02,喜欢不起来，很难想象和《踏血寻梅》是同一个导演。,-t,2
鬼腳七,2023-02-04 10:13:03,前两个小时就是大型的王家卫+许鞍华+吴宇森，把郭富城换成周润发，谭耀文换成梁家辉，杜鹃换成张曼玉，何珮瑜换成杨采妮，就有那个意思了。后半个小时和前面完全不是一回事，整个气质都变了，但是许冠文高光，牛逼。,30,9
网约车,2023-02-03 21:42:24,故事无聊，段落式电影靠胶片和回忆营造了一点文艺氛围。感情线四不像，结尾强行拉回来，不好看，耐着性子看完。有春光乍泄和花样年华的痕迹，导致杂糅且混乱。不过摄影还可以。,20,19
直胖,2023-02-08 21:56:32,视听语言混乱，心疼伟仔演这种烂片,20,4
那谁,2023-02-03 20:43:53,救命！港探旧时拼接片段回忆录？,20,18
一只不知名猫猫,2022-09-27 17:24:23,去年看的，杂糅太多种类型，导致越往后看越像一张被水泡碎的纸，不差，没那么好。,30,18
Sanders03,2023-02-04 22:24:06,如果说画面是血肉，配乐就是支撑的筋骨，有条件一定粤语场。门槛蛮高，在点到即止的历史洪流中，有相当多的细节需要观众脑补，但get到真的很开心。贯穿全片的爵士乐极佳，与精雕细琢的布景构成近年最佳港片体验，全片间歇性的精彩，烧钢琴的镜头和春夏的昙花一现真的很适合回忆，香港电影这个时代有翁子光是一份福气，他在构建自己的《巴比伦》,40,1
宝宝,2023-02-11 03:34:09,这很难评，我祝他成功吧，毕竟隔行如隔山。,20,6
Hi Friday,2023-02-04 22:06:40,特意在厦门找了粤语场，香港电影肯定要看粤语的！国语太没味道了。可惜我的香港粤语还是太差，好多完全听不懂的😂,40,5
yuyuko,2023-02-04 20:13:49,还有四十分钟，好难熬,20,19
你说什么？,2023-02-04 14:43:04,wkw能不能把什么宝马迪奥的广告匀几条给翁子光拍拍 不然他拿电影来搞真的难顶 （两颗星都给大银幕tony仔,20,5
上北山,2023-02-03 21:36:07,画面音乐喜欢😘但是剧情是什么。想讲的太多了没有层次。一度打哈欠🥱旁边人一直看表,30,6
阿德,2023-02-27 20:06:34,香港黑帮片情书,30,1
牛油打孖,2023-02-04 19:01:40,一下子被塞進了太多東西，中間不斷插入閃回，讓人眼花撩亂。但，梁朝偉真的太迷人了。,30,8
发条子橙橙,2023-02-03 21:37:29,叙事有待改进吧，好多莫名其妙的剧情和人物，还有装逼镜头和台词…不知道到底想表达什么，希望能好好讲个故事，文艺片也不一定要拍成mv才文艺。,30,9
幻聽麻瓜,2023-02-03 22:35:24,跟预想中差不多的拍法，工整有余，匠气盖住了灵气，跟郭富城主演的另一部电影浮城大亨略像，在情感发力上没准还输了一筹。手握几乎半璧香港影坛的卡司和配置，在当下此刻转头回望，至少该与烟尘滚滚的人事音书撞个满怀，但这一次的眼光停放处还是选得不咸不淡了些。,30,7
forfaen,2023-02-04 21:40:30,剧情非常赶，故事很碎，剧情谈不上有张力，女性角色塑造甚至可以说很失败。但是有一些莫名其妙的镜头真的很戳我的点，比如结婚那日穿着旗袍的杜鹃捶小腿的镜头，枪战在玻璃下仰拍的镜头，衣柜play，八卦镜镜片掉出来，黑豹扑食，很多很灵性的镜头语言配上梁朝伟和郭富城的帅脸，2个多小时也并不乏味。,30,1
leoleo,2023-02-10 20:15:00,比想象中好一点吧。。。大厨做的夹生饭。最开始那一段剪的好乱啊。。。结尾晚年拍的也有点累赘。。。原来七十年代就开始贪官跑路温哥华啦。第一个优点，回顾了很多历史上的点，gmd在hk。抗英等等。用了真实录像。第二个优点，把杜鹃拍的很美。装造都很不错。她长得的确有当年老上海的感觉。第三个优点，把春夏拍的很好。那一段是我觉得单拉出来不错的一段。春夏人美戏也不错。 槽点还有两位男主真的太老了。。。。五十多的人演三十多的人。。。“年轻人”真是尬死我了。。。这些演员看了三十年了。我们华语影坛是真没人了吗。梁朝伟和老婆完全父女感。。。。郭富城那个肚子吓到后排几位小姐姐了。。。有些情节挺狗血的。。还有配乐有点奇怪。。。。学王家卫土洋结合失败,-t,1
侯晓林,2023-02-13 15:25:02,想拍好史诗感的片子，必须有通俗剧和商业片的功底。本片拍的最好的段落是郭富城和春夏的部分，非常近似 踏雪寻梅 质感的部分。本片最大的问题，是作者的浪漫 高过了 普通观众，却又没到大师的程度。,30,0
Jasmine_长乐,2023-02-03 22:14:14,2023.02.03 粤语原声超前点映打卡。本来以为是之前一些雷探长电影的故事线，没想到是一部充分展现香港的历史和风土人情的故事片。卡司阵容真的很强大，我觉得不是从两位主角当中选影帝，而是从片中的所有角色数影帝。郭富城和梁朝伟的对手戏很有意思，两个探长一个是热烈多情的舞王，一位是忧郁儒雅的钢琴王子，整部片子就是他俩随风而起、相爱相杀（？）又随风而落的过程。情感线很有意思，杜鹃演的女主角色，作为一位的“朱砂痣”，正巧是另一位的“白月光”。,40,7
薇羅尼卡,2023-05-04 19:01:37,野心很大，完成很拉，某种意义上浪费了这个世纪豪华卡司。导演想表达的东西很多，造成的结果就是焦点模糊，再加上144分钟的时长，看至后半确实有点挑战耐心。杜鹃的服化真美，其余就没了。23.2.3,30,0
