用户名,评论时间,评论内容,评分,赞同数
Haru24601,2022-01-08 00:23:42,三星半，妈妈演得是真的好！剧本还不错，叙事很连贯，将传统婆媳家庭伦理情节融入潮汕风味后颇有新意。影像整体质感差一点，包括两个年轻演员，但是作为一部低预算电影，可以理解。,30,6
李湘,2023-01-15 23:36:53,如果，我爱你就要去你家生活，跟你的爸妈和三姑六婆一起生活。可能我会选择分手吧。虽然，我很喜欢吃潮汕菜。,40,0
生活在别处,2023-02-15 18:44:22,"8/10.
在深圳工作的潮汕人男主带着外省未婚妻回老家，但女朋友离异过一次的经历让妈妈女主很不高兴。
本片的大部分台词是用潮汕方言来说的，有着浓郁的地方特色，当地的生活，习俗和食物尽显银幕，也有笑点。
相比之下，爱情故事只是个陪衬。
扮演妈妈的演员好像是个非职业演员，却演得非常自然，很贴近角色贴近生活。奶奶提供了很多笑点，也是非职业演员吧。
最后的和好有点生硬，铺垫不够。",40,0
Leo🌊,2022-11-04 12:16:27,很真实很有生活气息，传统的东方家庭对于婚姻的掌控力还是很大的，堂姐和她男朋友分手也是基于此。,40,0
夏目吾冬,2022-05-08 16:03:23,还不错的地方本土电影。3+0.5,30,0
kiki204629,2022-02-24 21:45:17,很真诚的电影。,30,0
陆小凰||我爱浪味仙小康牛肉酱,2022-12-29 19:21:56,好有意思，尤其是最后一段好真实。但到机场追人的情节就有点刻意了…,40,0
Hugo,2022-07-24 19:56:19,实在无缘看不下去,-t,0
时而沧桑,2022-03-05 21:20:43,第一次看潮汕电影，有一股亲切感,40,0
肖浑,2022-03-18 19:41:56,开头还以为是劣质烂梗喜剧，在媚俗和民俗之间两头拉扯，还好后者逐渐占了上风。这个妈妈太真实了，尤其是后来去深圳和杭州，处处都能看到我妈的影子，素人演到这个程度还是挺厉害的。,30,0
无心人,2022-07-13 13:52:50,还蛮好看的，跟着电影也入乡随俗了,40,1
声色画报,2023-01-02 18:24:22,还是很温暖和治愈的片子，第一次看潮汕话的影视作品，还有很好听的几首潮汕歌曲，多数演员都是真实的0表演基础亲戚乡民，让这部作品非常接地气，也很真实。虽然剧本简单，但就像我们身边发生的一般朴实无华。,40,0
痞人纯良,2022-04-29 23:59:49,3.5 前面节奏不错，也穿插了不少小笑点，整部影片也展现了很多地道的文化，就是后半部分内容有点拉胯。,30,0
ReMinD,2022-12-29 00:21:01,"作为和潮汕有类似文化的客家人 还是挺有感触 我老婆第一次回家也越到类似的事情。
结尾如果不要强行圆满的话会更好。",30,0
旺仔小王子,2022-02-26 23:54:45,之前对潮汕的印象只有潮汕牛肉丸/奶奶好好玩儿/真的是纯方言，普通话对白都没有二十句，完全听不懂，全靠看字幕,40,0
Xao,2022-03-19 22:49:58,汕头爱情故事，比较新鲜的。,30,0
Shirleysays,2022-04-10 14:43:20,#🍋观影# 与大鹏的《吉祥如意》相同的题材，都是讲风土与生活，更喜欢这部。轻松、温暖，美食和音乐也很好。片中的妈妈真可爱。嗐，有点想我妈做的菜了。,50,0
第五原宿,2022-03-10 02:37:06,俗套俗招較多，但也有細膩可愛的生活質感。未來可期。,40,0
小姚的吉姆餐厅,2022-12-27 13:42:42,"妈妈演得太好了！想起我伯妈了。
片子的喜剧化处理也做得不错，最后模拟手机vlog拍摄也挺好。
唯一不能接受的就是片子的音乐，今年看了很多台湾电影闽南音乐是很喜欢的，但是不能这样用啊！随随便便就mv段落，太多了！",30,1
L.L,2022-03-02 06:34:09,这样的方言电影，让导演拍出了一种难以言说的真挚.,40,0
小煎,2023-01-02 15:55:15,"潮汕人真的这么排外嘛……
我要是能领回来这么好的女朋友，别说离过婚，就是带个娃估计我妈都得按着我的头赶紧娶了她",40,0
____anybody,2022-09-12 00:15:48,镜头语言非常稚嫩，但这妈妈太有说服力了。看到结尾的时候，很好奇我妈第一次坐飞机的时候是不是也这样。想起有一次我妈抱怨，为什么你们年纪轻轻就整天出去玩，老妈都这个年龄了也没玩过这么多地方呀……😫,30,0
Oscar,2022-03-23 20:56:47,家庭婚姻,30,0
呱唧呱唧,2022-03-02 16:09:45,很奇妙的一次观影体验 在看之前我是不知道自己和女主有那么多相似的经历 可能人生如戏 戏如人生吧 陪你看电影的那个人 才是决定你爱不爱看电影的原因呐,40,0
南之禾,2022-10-05 13:02:32,故事内核与《再见，妈妈》其实是一样的，都是带着“媳妇”去见妈 ，新生与传统的碰撞，两代人的对话。《再见，妈妈》好在细腻，这部好在自然，两者都有个可爱的奶奶，也没有特别浮夸的剧情，只是简单的拍出了生活的气息，这就已经很迷人了。,40,2
滑稽,2023-01-01 14:58:26,也不光是潮汕地区的观念问题啦，好多地方都这样，希望还是能尽量思想进步。,30,1
Feifei Sun,2022-09-17 18:57:58,"剧本还是典型的婆媳合家欢 但胜在细节的描绘：潮汕地区的民俗、民风和民乐在这都有体现。虽然对于中国家庭关系和婚姻的解构够不上李安的等级 但也是触碰到了婚姻与家庭关系最敏感的话题 一些小情节还是会有感动：第一次饭桌、妈妈们之间的攀比、各代之间婆媳关系、天台上的分手、机场上男主的回望发现是妈妈拦下了女友……
最喜欢最后那段伪纪录片式的长镜头：飞机上，妈妈充满着对第一次坐飞机的欣喜，突然之间脸色转为暗淡与寂寥，然后粲然一笑——“妈妈是不是很没用啊”
接地气就是赢了！",40,0
暴殄天物,2023-04-19 11:27:39,很温馨的片子 母亲演出了所有人母亲的样子。,30,0
小锅子,2023-01-22 14:41:21,#春节观影# 很真诚的作品，细节也拉满，哭惨了。除了传统守旧的观念，我还是蛮向往那种连接紧密的大家庭，还有各种习俗。太喜欢潮汕了。,50,0
带鱼先生,2022-01-16 23:48:37,3.5，半颗星支持，😂,40,0
徐颂,2022-02-28 19:20:48,很可爱的片子！,40,0
想乱思,2022-02-24 17:00:20,就是地方台常拍的那种家长里短剧，只能说鼓励这种在地文化的创作，但电影本身并不好看。,30,1
zjy_xxss,2023-01-09 16:46:48,上映到观看，正好一年左右，时间很巧。看来中国的方言电影未来将是一大特色和卖点，很多方言电影都很棒，完全不输大制作。电影充满了爱和家庭，极其生活化的拍摄和演绎，充分证明了“观察生活的导演”才是好导演。生活的故事就是好故事，家人的爱才是最能共情的爱，这是一部爱情片，给观众品尝的却是生活这碗汤，甜而不腻很清爽。ps：女主角很耐看。,30,1
l.m.,2022-03-31 19:47:10,演媽媽的演員挺好。,30,0
只抓住6个,2022-02-27 12:09:55,加入地域特色的城市情感片,30,0
woniu2048,2023-01-02 15:30:48,温馨传统的婚恋剧，不做作。,30,0
蒙奇D,2023-01-09 22:24:41,本片公映一年了。公映的时候没去看成，线上看也不错。这片的电影质感不太行，但却比很多大制作的电影更有诚意。演员应该基本都是非职业的吧，但表现都挺不错。奶奶、妈妈和妈妈的对头阿姨这几个演员真的自然，演妈妈的演员有几个失神的表演非常到位。不看字幕完全不懂讲什么的潮汕方言电影能够公映，本身就是一种成功，何况评价还不错。片中几首潮汕方言的插曲也用得恰如其分，有一首甚至有些动人。电影最重要的其实不是投资，不是技术，不是演员，也不是质感，而是真诚。一旦主创展露了真诚，观众一定能感受到。,30,0
fay,2023-02-05 17:23:06,画面质感不佳，纪实感强。传统和现代的碰撞。,30,0
左加菲,2023-01-18 18:45:34,真实有温度的故事会被看到真好,40,0
刘白,2022-04-18 20:11:12,好真实且有点甜，浓烈的生活味呼之欲出，妈妈选得很好。,40,0
Hunterchou,2022-03-13 20:55:38,最近很喜欢看这种方言的电影，合口味，拍的到位,40,0
UnforgetMemory,2022-12-30 15:20:18,潮汕话还是听不太懂，但方言片挺好,30,0
Stubborn,2023-01-07 19:50:56,能感受到创作者是有诚意的，但是故事层面匠气太重了，演员大概除了男女主都是非职业演员吧？妈妈演的很好，但是其他演员就真的不太行，特别是静珊减分太多了…作为一部地域性特别浓厚的电影，可能也是意义大于质量吧,30,0
🐟🐟🐟,2022-03-12 19:58:19,其实有些段落很厌女诶，没有我想象得好,20,2
盲盒游戏戒断中,2023-01-02 01:24:22,对潮汕增加一点了解。（那首月娘啊～还挺好听的，不知道歌名是什么,30,0
努力努力再努力,2022-04-25 10:12:52,故事并不新颖，父母与子女新旧观念的碰撞，影片中展示的潮汕文化独具一格，演员演绎在线，部分情节上掉线，没有代入感。,30,0
。,2022-02-20 21:07:17,新鲜,40,0
果心居士,2022-03-24 20:33:01,看了导演的幕后才知道，原来是非专业出身的新人导演+飞机都没坐过的素人演员，单凭这两点，已经值五星了,50,1
逗号后面没有了，,2023-02-07 10:12:16,少见的反映潮汕文化的电影，一场受到世俗阻力的爱情。,30,0
只爱陌生人,2022-01-14 00:36:34,开头二十分钟，胖女孩相亲，梅林茂《花样年华》配乐出现了三次，真的很网大的感觉，甚至是恶搞视频的味道。。虽然我旁边两姑娘快笑疯了。。然后分手也分得太草率了吧。。但妈妈真是好，真实，可爱，演员也演的好。。媳妇就是工具人。。如果不是我预期太高，或与我期望的完全不一样，我可能会给三星。,20,4
船续前行,2022-03-09 23:58:55,晚上买的告别场因为疫情电影院关了，只能看腾讯视频。剧本到一些小设计都看得出刻意跟老套，但是难耐真实，熟悉的深圳与潮汕文化，有丶想回去吃东西。结尾手机视频+飞机神来之笔。,40,0
周宇勋,2022-02-25 02:39:48,继《雄狮少年》《白蛇传情》之后的又一潮汕方言惊喜之作。电影摒弃了多余的铺垫，单刀直入的方式很喜欢。剪辑配乐极致用心，对于潮汕传统文化的展示异常美妙。感官部分处理得当，无过度煽情与超负荷表演却更能突出人物情感。蓝鸿春导演很棒，除了母亲与爱情之外，电影的真诚也是足够打动人心的。且看到熟悉的深圳街景，有瞬间飙泪的冲动。小语种果然不负众望，方言精品。,30,1
浪客剑心剪刀手,2022-01-10 12:15:59,6.5分（方言电影加1分）。先说优点，小题材，制作还算不错，完成度高，也算优点也算缺点的是，素人演员用的多，除了母子，其他人多多少少看着很尬。缺点嘛，结尾用手机不知道是预算不足还是其他原因，我觉得是预算不够了，将就一下，很影响整体质感。因为之前重听反派节目看了主创前作，本来想夸一下，最后这段手机真的很拉胯。当然，这个主题的讨论很陈旧，也没什么新意，但是放在当下确实还可以，尤其是新年期间，很多人看了会有共鸣，再加上方言带来的信息差跟错位，确实还算有意思。主创还一如既往的夹带了海贼王的私货。就酱～盲猜，如果长线放映，票房应该还不错～,30,4
续燚淼,2023-01-31 21:16:21,网大质感，故事比较平，潮汕文化是亮点,30,0
艾米莉,2022-12-15 11:47:33,浓浓的文化，渗透在电影的每一帧里又不显刻意,40,0
山人阿苍苍,2022-04-04 15:22:28,梦幻般的结尾 但现实已经很惨烈了 电影是可以梦幻理想一点的,40,0
风继续吹,2022-03-05 20:04:51,［8.0］挺有趣的电影，可惜因为小成本和不知名主演导致没有上映到春节档。十分推荐要带女朋友回老家的哥们看看，提前熟悉下两个不同地域之间的差异和互相的磨合处理。,40,0
Jo-King,2022-02-16 21:36:55,跟妈妈吵架那段好真实。静珊这个演员就跟角色一样，疏离在整部电影之外。,30,3
樂(Yue)言,2023-02-27 11:34:28,真实入味，结尾有点太刻意了，应该有一点留白或许会更动人！,40,0
