用户名,评论时间,评论内容,评分,赞同数
深夜声噎,2022-01-25 20:29:35,20220125@周二晚票价十八块，几乎包场，字幕走完清洁阿姨才走进来还问我就你一个人？错过免费场，还好最终没错过。好看，撑大粤区好电影给配乐和他妈加一星，原音方言版当然。,50,7
我呼吸的空气,2022-01-19 23:39:58,上春节档吧，切拜！2022.1.19 主创连线场。如何善用素人演员创作，通过本片纪录片出身的导演应该是摸索出了一套自己的方法。真实太打动人。给妈妈的演员点大大的赞，浑身是戏(生活阅历）。唯一的专业演员（女主演）也相当不容易，居然只有25、26岁，本人相当软萌。,40,3
luer..一串字母,2022-03-01 01:02:59,赚了我好多眼泪😭😭😭，最后冒出个恶趣味的念头是，如果她小儿子是同性恋，有这么个儿媳妇了，妈妈估计都要高兴死了😂😂😂,50,1
醉梦·聊生,2023-01-25 16:00:49,妈最终在儿子的喜欢与该死的封建之间选择了前者，外省的不行，离过婚的不行，所有的不行最终都会在更新换代的观念洪流中被冲散，母亲爱儿子，就必然要尊重儿子的选择，主题很传统，配搭以传统的祈福、潮汕话、本地歌曲，让故事有了一定的新鲜感。,30,0
Vivian,2022-06-16 19:47:31,有点台湾电影那味儿了,30,1
mpor2,2022-12-30 01:16:04,哇，好有味道的电影呀~想吃潮汕牛肉丸火锅啦~,40,1
VivianS,2022-03-05 16:04:33,非常接地气的电影，只能说剧本的一些创作上有些刻意，作为鼓励可以给四星，提升空间还是挺大的，男主的家人们演技最好,40,0
又又,2022-01-19 22:30:08,除了开头那个胖女孩的片段让人不舒服之外，全片都很好！节奏很好，完成度很高，很朴素但很温情，笑点还超多，结尾妈妈对着假雷峰塔立马拜拜真的笑死我！映后和导演演员连线，妈妈还是那么可爱！导演说身边太多潮汕人都是因为各种原因（八字不合、外省、离过婚）等原因分开，所以想拍一部电影来打破世俗成见，真好！,40,16
热带疾病,2022-01-08 10:39:36,这就是一个当下的电影，在对传统文化进行回溯的同时也在自省，并且通过让妈妈这个角色第一次搭飞机出门去往她口中的“外省”-杭州，将“走出去”的意识行动化。导演把潮汕拍的太有烟火气了，谁不想住在一个海滨小城又带庭院和天台的房子里啊。也许很多人一听到潮汕方言电影就会自动认为低成本制作电影感不够，其实不然，这一部在流畅之余很多镜头都非常讲究，能把素人演员调教到演技放在大银幕都让人拍手叫好，导演的审美和调度肯定不在话下。我甚至觉得最后直接用手机摄像头来拍摄是神来之笔！,40,10
cassetteman,2022-04-23 05:50:01,"tags: 2020s / 中
特别好。青年无力撕扯故乡脐带，故乡则在叹息着接受新的规则。妈妈演的最好，但明显在都市的戏，导演就没有在汕头的灵动了，有点可惜。",40,0
饮歌,2022-03-09 06:33:29,虽然看着有点糙，缺那么点电影质感，但是感情一点也不糙，跟老妈互动的每一个瞬间那种质感，无论是不是电影这种载体，都是最真切、最厚实、也是最优的质感。,40,0
寒塘鹤影,2023-01-04 00:51:25,方言电影,40,0
这是一个小号啦,2022-01-10 11:07:08,作为土生土长的潮汕女孩，刷抖音的时候看到这部电影，简直倒胃口。村口三姑六婆肆意议论别人家事，家长对孩子以爱为名进行操控，对儿子的爱人缺乏任何尊重。是，非常真实，所有女孩子都应该看看，和潮汕人结婚就是这么屈辱，电影还是美化过的。主创团队是脑子有坑，难道拍这种电影还觉得大家应该鼓掌叫好，这种潮汕宗族文化背后是多少女人的血泪！我不相信主创团队中一个潮汕女孩都没有，你们是斯德哥尔摩重度患者吗？,10,190
西决,2022-12-29 19:12:26,妈妈爸爸奶奶小舅演的都好好啊！尤其表扬婵真婶！,30,0
姓暴暴躁的暴,2022-02-14 21:28:23,我为上海没有多排片而哭泣，从头到尾都很喜欢,40,5
嗜热链球菌,2022-04-10 21:07:26,看这部电影中一直感到观念的冲突，或许我已经不算是一个正宗潮汕人了，一个素质这么高条件这么好的女生，跟这么一个男生本来就委屈了，还要去潮汕舔未来公婆，看得人生气——很好地延续了潮汕话电影一贯以自恋型男生作为主角的传统。这么排斥“外省”的应该是男主奶奶这一辈人才对，现在潮汕人和外地嫁娶多了，男主爸妈这一辈早都习惯了。电影还是有很多不成熟的地方，比如低俗的插科打诨，不好笑又尴尬。相比之前还是进步了。潮阳话真是超级难听懂，尤其是男主爸爸，让人一句都没听到。,-t,2
里昂,2022-02-25 00:26:57,"很多时候，你不坚持一下自己， 你就不知道父母是绑架你的生活，还是爱你无论有没有按照他们的意志而活。一生要强的妈妈，最后为了你的幸福还是选择了妥协。

只可惜男主还是妈宝了，都没坚持一下下自己，两年的感情随随便便就放弃了。如果他的爱只是因为他妈的摇头就停止，在一起全靠他妈的妥协，现实里遇到这样的男的，还是有多远逃多远吧。

看完上海话的《爱情神话》再看潮汕话的《带你去见我妈》，都有一种遥远的亲切感。果然，方言的才是世界的。

最后，“要不要我教教你，记得先脱裤子”的你奶炸了哈哈哈哈哈，可爱而又毫无违和，果然活到一定年纪什么都可以看开了。",30,2
更深的白色,2022-04-30 17:52:54,在能力范围内做得还不错，“带你去见我妈”，“你”只能是一个被带的主体，拍不了你我还拍不了我妈么。潮汕方言环境的陌生化，给一个不求突破的故事带来了挺轻松舒适的观感。,30,0
天凉气清,2022-03-17 23:46:07,那个妈妈演得好好,40,0
齐咏歆,2022-06-30 15:40:54,这部电影是豆瓣标记的2000条，很接地气的电影，剧情很简单，但还挺打动人的,40,1
MY BMM,2022-02-25 23:06:49,看完想家，想再去趟汕头，想结婚,40,0
惠子,2022-01-17 10:38:42,很成功的小成本电影。刀子嘴豆腐心，挑剔保守却也勤奋善良的母亲形象塑造得鲜活立体。传统潮汕文化与都市文明的碰撞、择偶问题上代际观念的差别、母子之间的恩情与矛盾，影片想要实现多种因素的平衡实在不易，故不得不使人物形象在某些方面趋向与现实不甚相符的美好（例如女主除了离过婚几乎没有“缺陷”、潮汕母亲完全不看重日后的孙辈是男是女），从而实现一种让渡，如此才能为影片画上圆满句号。正如简·爱继承遗产，罗切斯特断腿眼瞎之后方终成眷属一样，影片的设定有保守主义之嫌，但已然是文明向前迈进的一步。一星给演妈妈素人演员。,40,7
电影协会,2022-02-25 01:28:08,虽然我也两次到过潮汕拍电影，但是纯潮汕题材电影我也是第一次看，首先用了偏向极端的人物关系，挑战潮汕传统妇女的观点，但是看到中后段感觉剧情有点拉跨，几处分分镜表达不恰当，当我以为我会给这部电影打低分时，最后一段手机拍摄的表演，把我感动了，尤其是妈妈的演员，就素人演员而言，最后一段的表演，是全片最好的表演，非常真实，非常令人动容。,30,1
Vince♫,2022-03-04 23:49:05,好的爱情电影，一定是让你感动，然后珍惜眼前人（而不是怀念初恋）,40,0
路,2022-01-13 01:03:56,真的是意外惊喜，虽然没去过潮汕，却像在看身边的生活一般，有笑有泪,40,5
韩先生的电影,2022-10-13 17:44:09,艺术真的来源于生活。我们现在科班出身的演员没有生活，他们又怎么能演好戏呢？,40,0
噬元兽,2022-03-09 23:23:53,牛皮啊这个结局,40,1
折翼的蝴蝶,2022-01-07 22:54:41,蓝导这次明显比上一部电影有进步，质感更好了。有几个镜头有将角色的情绪恰当地渲染开。妈妈若有所思的镜头很好地击中我。,30,8
影呆,2022-01-19 22:34:41,妈妈的角色从头到尾都非常真实自然。影片有很多有趣的梗（撞车后吵架发现对方是老乡，于是和解）和巧妙的处理（儿子情感受挫后发型变化展示人物内心的大波动），感觉导演很善于捕捉生活的细节。,40,1
苹果,2022-05-04 23:56:27,剧本太薄弱了，冲突，和解，都是很老套的部分，好在比较真诚，再好一点可以是潮汕版的四个春天。,30,1
冰镇西瓜橘子水,2023-03-11 15:15:27,很久没看到烟火气这么足 这么贴近生活的电影了 妈妈的演员是素人吧 根本就不是演 是真情流露 男女主楼顶分手那段看得人很触动 演员的演技比现在市面上那些木头不知道好多少,40,0
孤狼,2022-06-16 00:41:51,"不算特别的剧本，落地在一个特别的地方，有了新意
特别平常，但因为平常，所以能够体会",40,0
小柚子×旅行家,2022-03-21 23:51:46,潮汕女人真是我认识的女性群体里最能干又最固执的之一，一颗心全是为了家人操。片子烟火气很足，那种充满了大家庭的鸡毛蒜皮就莫名吸引人。救命，我也好想我妈😭,40,1
豆瓣路人己,2022-02-27 21:54:46,剧作比导演能力强,30,1
mangojune,2022-02-17 23:23:37,自然，生活，但又很戏剧。导演映后分享，会根据确定的演员再修改剧本，让角色和演员尽量贴合。讲真，这可真的是一种好办法，“妈妈”与“龅牙婶”真的好绝哦！,40,0
一壶好酒配热粥,2022-12-30 19:34:48,千万不要被看去好像是烂片的片名给误导，这绝逼是今年够味的走心之作。电影根植于潮汕的地域文化，观感上更像是一部民俗纪录片，尽管所谓的电影感有所欠缺，但饱满的故事线和地域特色都让它有了天生的土猛，方言完全不限制共通的情感。在母亲眼里，相夫教子是融入日常生活的责任，乡里名声是刻在骨子里的信条，这是潮汕民俗对婚姻观念的牵绊，这些传统渗透进了每一个家庭，电影也正是通过两代人不同的观念冲突，体现着随着时代变化母亲一步步的思想转变，从细枝末节处还原到了充满烟火气息的潮汕乡土里。无论如何母亲对儿子的爱胜过一切蜚语流言~,40,1
茗政.,2023-01-07 02:32:09,本不该这么难过的……母亲与儿子、传统与突破，除却介意别人的眼光是最难跨越过去的坎之外，可以代入映射的不仅是潮汕（中国）根深蒂固了两千多年的思想被新时代冲击，更是这群素人演员，用自己的生命体验来表达，赐予了影片那些无比真实的瞬间。,40,0
Guanyuzhizi,2022-02-06 02:52:34,技艺上的些许生硬倒是让电影多了分自然的亲切感。// 信息化社会与传统习俗交融的艰辛，小蝼蚁穿梭在摩天大楼之间呕心沥血地打拼，一同映射出了这个时代违和又有趣的光景。// 男主角貌不出众，却帅气地演出了小人物的谦和担当。// 一首首歌配得揪甘心。,40,1
小柚子×旅行家,2022-03-21 23:51:46,潮汕女人真是我认识的女性群体里最能干又最固执的之一，一颗心全是为了家人操。片子烟火气很足，那种充满了大家庭的鸡毛蒜皮就莫名吸引人。救命，我也好想我妈😭,40,1
秋水,2023-01-07 11:36:26,是否有不被理解的爱情,50,0
苹果,2022-05-04 23:56:27,剧本太薄弱了，冲突，和解，都是很老套的部分，好在比较真诚，再好一点可以是潮汕版的四个春天。,30,1
豆瓣路人己,2022-02-27 21:54:46,剧作比导演能力强,30,1
mangojune,2022-02-17 23:23:37,自然，生活，但又很戏剧。导演映后分享，会根据确定的演员再修改剧本，让角色和演员尽量贴合。讲真，这可真的是一种好办法，“妈妈”与“龅牙婶”真的好绝哦！,40,0
菲利普,2022-06-15 18:18:10,讲普通人的故事，有地方特色，但是剧情、节奏、表演都差了点火候。最后太拖沓了。女猪脚不好看，眼窝看起来十分怪。,30,0
1w.,2022-05-08 06:12:35,很无聊 只看了40多分钟，不是我不想看完，因为垃圾咪咕视频一直掉线 看十几秒要重新加载60秒广告，我看了十几次广告了。电影已经没心情看了。,10,2
一壶好酒配热粥,2022-12-30 19:34:48,千万不要被看去好像是烂片的片名给误导，这绝逼是今年够味的走心之作。电影根植于潮汕的地域文化，观感上更像是一部民俗纪录片，尽管所谓的电影感有所欠缺，但饱满的故事线和地域特色都让它有了天生的土猛，方言完全不限制共通的情感。在母亲眼里，相夫教子是融入日常生活的责任，乡里名声是刻在骨子里的信条，这是潮汕民俗对婚姻观念的牵绊，这些传统渗透进了每一个家庭，电影也正是通过两代人不同的观念冲突，体现着随着时代变化母亲一步步的思想转变，从细枝末节处还原到了充满烟火气息的潮汕乡土里。无论如何母亲对儿子的爱胜过一切蜚语流言~,40,1
小小斌,2022-07-20 14:47:24,看的真的太舒服了，尽管都是一些家庭琐碎，但是能感受到弄弄的烟火味，也能趁机了解一下潮汕，有熟悉又新奇。,50,0
谷醋,2022-01-12 21:59:05,很喜欢的电影，在电影里生活，真实和平凡的问题，或许有心却无法解决。明明都是很好的人，可偏偏难两全。感谢还有惊喜出现，慰藉一些。,50,3
荒淫少女朴赞郁,2022-02-27 11:14:46,简单温情,30,0
茗政.,2023-01-07 02:32:09,本不该这么难过的……母亲与儿子、传统与突破，除却介意别人的眼光是最难跨越过去的坎之外，可以代入映射的不仅是潮汕（中国）根深蒂固了两千多年的思想被新时代冲击，更是这群素人演员，用自己的生命体验来表达，赐予了影片那些无比真实的瞬间。,40,0
Spy Liu🌈,2022-11-09 13:15:21,剧本还需打磨，不过很真诚朴实。,30,0
热爱赴山海,2022-12-28 01:50:37,这是个vlog吧？,30,0
当ism,2023-01-01 16:06:12,天啊，没有想到这是我22年最喜欢的华语喜剧。朴实，动人，不矫情。太难得了。看晚了。,50,4
汾河水怪,2023-02-28 22:18:08,勉强可以的家庭喜剧片，当地人文自然景观展示，矛盾冲突俗套且有点牵强，都这年头了，还拍这种母亲摇头就分开，母亲点头就在一起的封建故事，可悲可笑。反映传统与时代对抗的想法可以理解，但人物全都跟着剧本走，缺乏感情和灵魂。,20,2
Guanyuzhizi,2022-02-06 02:52:34,技艺上的些许生硬倒是让电影多了分自然的亲切感。// 信息化社会与传统习俗交融的艰辛，小蝼蚁穿梭在摩天大楼之间呕心沥血地打拼，一同映射出了这个时代违和又有趣的光景。// 男主角貌不出众，却帅气地演出了小人物的谦和担当。// 一首首歌配得揪甘心。,40,1
春夏秋冬,2022-02-25 22:59:42,在潮汕本土电影里看到台湾电影的影子，未来可期,50,0
Sunny,2022-12-25 21:06:09,4.5星，别样的温情。妈妈怎么演得那么自然，好像在看纪录片,50,3
点击即刻爆炸,2022-08-17 22:50:48,感觉挺到位的，就是这种封建家长的角色真的喜欢不起来…,30,0
Travis,2022-01-16 11:55:06,哈哈哈哈哈，奶奶简直是个活宝，笑不活了。笑点的打磨比前一部更用心更密集了。跟前一部没有必然联系，完全是另一个故事了。镜头摄影也比前一部更精致了。有个镜头印象深刻，阳光透过云层洒在远处的山上，近景的海浪一波接一波，就像人生，免不了许多波澜。这一部情感处理更加细腻，婆媳关系从陌生到熟悉再到陡然激化，层次更加分明。家人之间的疙瘩总是要通过沟通去解开，虽然过程会有艰辛，有一方先示弱，总会有解决办法的。潮汕的习俗，潮汕麻仁的偏见，两代人之间的隔阂，奶奶的开明，不同年龄层不同立场，没有所谓的对错。最后还是熟悉的戏份，男主跑到机场找到女主，意外的是没有挽留，女主也没有回头。最终还是he，开心～加一星支持潮汕电影，加油！,50,6
Cardinal,2023-02-06 02:42:01,【D+】虽然努力拍出真诚，但依然改变不了陈词滥调的事实。,20,0
seamouse,2022-01-21 18:34:55,最保守地方的习俗和方言，很好的容纳进了非常现实的故事里，不避讳人种肤色肥瘦的切实偏见，结果却居然能有高于现实的浪漫。,40,2
吸橙,2023-03-07 15:02:09,妈妈这个角色和演员，是这部电影最棒的地方,30,0
兔安叽,2022-12-28 22:02:13,豆瓣2022评分最高的华语电影榜上有名，就这？阿北把你的榜单算法改改好吧。导演很努力想拍出潮汕文化的过去和未来，但又免不了直男自我感动式歌颂家庭和爱情。你有在房顶看你妈搬煤气罐感动的功夫就不能下去帮她干点活吗？,20,1
小生影书,2022-12-29 21:17:01,没有什么十分出名的演员，十分朴素的一部电影，还略带着纪录片的风格，却拍出了感人的家味和乡土风情。传统的汕头当地风俗，会勾起对家乡的思念，古板封建，但总还是人间真情。所以两个人能够在一起，真是一场极大的缘份。,40,0
Nemooo,2022-03-11 17:34:40,素人主演的优缺点都很明显，乡土化很成功，最后的转变也不生硬，有闪光点也有好听的BGM~,30,0
少年赵里昂,2022-12-28 22:37:51,非常简单真挚的一部电影，没有任何技巧和野心，甚至有些缺乏电影质感，故事也极其简单，却莫名的打动人。引入地方文化对电影加持很大，几位演员选的也挺好，尤其演母亲的素人演员很真实。,30,0
粪海狂蛆,2023-01-30 12:07:27,可以，但没必要。日常琐碎拼凑，也没提炼出什么，像一出不太好笑的小品，或者一桌没什么味道的饭菜。属于可看可不看那个系列的，但是基本上看了也等于没看。,10,1
左眼看电影,2022-09-11 21:45:15,温柔而用心的一部电影,40,0
slut queen,2022-03-13 19:49:40,拍的好好，很平实温馨，想起看俗女那些情绪，潮汕歌好感人，妈妈这个人物特别真实，无论是不是潮汕人都会共情吧,50,0
rayliao,2022-03-19 23:43:39,本土电影来说，算不错了，鼓励下,40,0
杨零度,2022-03-14 17:34:26,环境与传统左右了人内心的真实。小成本作品，没有惊喜的那种。,30,1
秋陌离,2023-01-28 08:50:18,很喜欢电影中展现的汕头生活细节，做饭、洗澡、拜佛等等，方言也有意思，大的情节就还是让身为一名女性有点难受，知道这是现实，甚至是美化了的现实就更难受,30,0
三童,2023-01-04 22:03:55,看这个片子有个感觉，中国人的生存方式类似珊瑚，以整体的方式生存。所以，娶妻就是家族娶一个新的组成部分，以发展出新的枝头。,40,1
陈哈,2022-02-28 11:17:24,被分数忽悠了。内核很“陈旧”，情节也很套路，音乐铺得太满，女主一亮相，我以为是田某珺，差点直接退出...  ... 想不通为何会有7.5分，可能能满足很多观众听潮汕话的需求？可这跟电影质量没什么关系。,30,4
刹那。,2022-12-27 18:52:05,有点像电影频道投资的那种项目 没有明星 甚至演员都相貌平平 但是拍的真实感人 只是事情太小了,30,0
Jasmine,2022-03-31 23:22:34,很平实又挺可爱的，后半段剧情垮了，结尾的处理方式又给掰回来一些。方言和音乐（主要是方言歌曲）加分。,40,0
最幸运的幸运,2022-12-27 15:08:58,可能需要更了解一点潮汕地区的特色吧。不过我不喜欢这种无力感，太残酷太无法避免，结尾是想象中的圆满而已，终究是带着遗憾，总有一个人要勉勉强强的。,20,1
人出没注意,2022-08-17 20:58:33,第一次看潮汕方言电影，其实是带着一点点猎奇心态，全片看下来简直惊喜，完全超出预期得好。,40,0
秋霆小朋友,2023-01-02 03:04:17,作为广东人，感觉很多生活细节挺还原的～意外惊喜。,40,0
waking王小心,2022-03-01 02:07:48,国产片都这么好好拍多好，除了情节有点简单没毛病,40,0
李气清,2022-12-29 20:20:25,比前作好太多了！别让演员演驾驭不了的角色，文本别贪心，完成度直接起飞。本片是比《隐入尘烟》更成功的乡土影像尝试，《隐》更多是一种建立在自然主义上的寓言，本片则是深深扎入现代中国与乡土中国的联结处，每个老百姓都能非常容易地代入故事情境。故事极其简单，但一整套源于现实、发乎真情的地方文化与语境让故事的演绎过程精彩纷呈，不管是主要人物还是次要人物，只要给戏就能出戏，蔚为奇妙；甚至人物偶尔表现出的“不顺畅感”使影像愈加可信。曾听闻潮汕地区习俗繁多又排外，两点都在片中得到印证，因此本片除了影像价值外亦有丰富的社会价值，润物细无声地反抗着封建主张。主创团队继续走这条路，日后未必不能同贾樟柯相提并论。另外，OST水准真是超级高啊！,40,1
Quasar，,2022-12-29 21:12:57,又青涩又真诚，导演给妈妈写的一首诗。,30,0
青鱼,2022-03-05 22:03:58,"很真实，很真诚。
很多地方都看哭了，细水长流，先看了这部，确实很成熟了，但其实有点太电视剧了。
就是感觉和是枝裕和那种细水长流的很不一样，有种九十年代那种苦情家庭剧的感觉。但好在很真诚，叙事虽然没有大起伏，但也还算流畅舒适。
片里的好多首歌都好好听啊，感情很浓郁。另外很多潮汕风俗展示，拍出了专属的潮汕片，虽然很多元素其实还可以再多加强一点，但做到这样已经很不错了。
这样真诚的地方片，叙事也自然流畅，值得鼓励，评分和我预期很吻合，我也觉得是7.5。",40,0
叩歌,2023-01-07 22:47:39,1、很惊喜的黑马喜剧，拍得大巧若拙，贵在返璞归真，展现真实的潮汕小城生活状态，具有市井烟火气和慢时光氛围；2、现代爱情与传统宗族的碰撞，打破根深蒂固的东西很难，但母亲心疼孩子的心也是亘古不变的；3、最喜欢的是分手后母亲去深圳探望儿子的段落，怅然若失，想要挽回又不懂表达，机场突然蹦出一句普通话瞬间击中内心，让人泪目。,40,0
彩戏师wala,2023-02-12 23:52:10,真情实感 真美真绝,40,0
阿托品,2022-02-28 17:01:37,简单，好看！,50,1
沙漠孤客,2023-01-17 11:58:31,这部潮汕为背景的电影很温情，拍摄水平有点像电视剧，拍的中规中矩，不过可能现实会更骨感一点，还是很好看的很温暖。家人是中国人最深的羁绊。,-t,0
Lady Midnight,2022-01-13 22:01:04,片子上映一周还没攒够开分人数.. 独立电影质感 潮汕文化标志全面展现 / 奶奶黄色劝告好评 猪油炒麻叶好评 / 生活化 可能也太过于生活化,30,0
玩儿少,2023-01-05 19:32:45,他们在汕头体验当地文化的时候真的很有烟火气啊！而且这话题也挺现实的，带对象回家见家长，家长的思想比较传统，但是最后又很温情。,40,0
格林童话,2022-09-05 13:36:50,做人太难了,30,1
一只特特呦,2022-12-31 01:00:54,"潮汕家庭喜剧？
腾讯视频的“六六六”和“裂开了”等一些字幕应该是有意为之，全片的幽默方式对我来说都有点奇怪。
合拍的两个人，大家都很喜欢，却因为离过婚、外地人而不被妈妈接受，甚至一直用“外省”来称呼她，以上电视为契机突然态度大变。
我会更喜欢最后那段DV一样的家庭录像。",30,0
未卜,2022-04-04 23:46:07,小成本电影就应该这样拍，有些笑点确实蛮不错的，奶奶和龅牙婶儿都挺好，但是整个作品像是因为缺乏更高水准的指导，而导致整体完成度并不高，像是一件未经打磨过的出厂产品，很好用很实惠但是不成熟不高级。,30,0
于成,2023-01-03 22:19:56,剧本、表演、镜头语言都很业余。民俗文化滋养下，代际矛盾不攻自破？撒尿滋到镜头上，求婚说“我想当爸爸了，可不可以帮个忙”，老公公光着膀子见儿媳（还不止一次），奶奶总想教孙子生孩子……被评分骗了,10,0
随缘与肖笨笨,2022-03-02 00:14:00,奶奶太好玩了…,40,1
宁静致美,2023-04-18 13:07:05,普普通通的家长里短，被展现的如此声情并茂。虽然听不懂潮汕话，不了解潮汕风俗，还是轻而易举的被代入到了家庭里，为他们的离聚而悲喜，这就是对待人生，对待电影的诚意。,50,0
阜薰,2023-04-02 23:29:26,潮汕风情扑面而来，也不是潮汕啦，离异女嫁未婚男，哪里的男方父母都是道坎，影片是温柔的，如同近片尾的闽南歌曲一样，欢快得娓娓道着难事，还是希望天下有情人终成眷属，都能得到父母的祝福；现实都不是男方父母的反对，而是一个相貌好，工作还不错的未婚男会愿意娶离异女的故事太少啦，所以，看完还是有点难受。明明是Happy Ending.,40,0
abru,2022-01-15 23:02:41,太自然了,50,0
希哈。,2023-01-01 13:44:45,这个妈演的真好,40,0
🍑Polaris.J,2022-05-09 01:19:39,"妈妈真的才是女主吧~！
No.18",30,0
