用户名,评论时间,评论内容,评分,赞同数
ᴚɐᴛsᴏʜ⅁,2023-04-28 20:53:41,超出预期的好看，笑点很多，范丞丞演技不尴尬不出戏，泪点也是有的，但是不是刻意煽情的那种，整个电影很顺畅，逻辑剧情没有什么大的硬伤，全家都能看的那种。配角方面百乔挺让人惊喜的👍,50,106
Oasiis,2023-05-05 23:51:15,两星半。为了喜剧效果塑造残缺的角色也能接受，但一旦立意拔得太高，这种立意的饱满性立刻让角色的残缺性暴露无遗，所谓的笑料也不好笑了。,20,0
靖靖子,2023-04-28 21:42:41,范丞丞是个好苗苗,40,31
NJ安可,2023-05-03 16:52:22,不在我的笑点上，一个没笑，但结婚那里哭了。这片之于我相当于《沐浴之王》,30,0
muzilang,2023-05-01 20:56:47,易小星有进步，但是他的水准也就那样了，俗套的故事，俗套的笑点和人物表情，结尾套路的煽情，额，我不吃这套！,20,2
顾毁,2023-04-30 21:48:45,"真是令人惊诧的翻身之作，易小星之前类型片用力过猛的毛病在快节奏的喜剧片里几乎翻成优点。画面和语言无数次形成互文，没想到成堆使用的效果这么好，成功把握了“暴漫”和meme的冷式笑话精髓，明明幽默的方式算不上高级，霹雳咣啷砸你一脸，想不乐很难，影院的氛围非常好。唯一的缺点是这个价值上的不算让人讨厌，但是还是生硬了点。诚意之作，可以说在抛梗笑料类型中做到了很高水平，作为喜剧商业片相当讨喜，但距离真正有血性的喜剧片还有距离。
Ps.对大卡车司机的关注有但是不多，但有一个细节我很惊喜：乔杉的脸很黑但身子没有。这个细节很细，我父亲就是这样的。",40,37
小楼一夜听春雨,2023-04-30 10:26:31,头回就把岳丈冻得与猪肉一体，接着对着群猪喊岳丈哈哈哈哈，所以周东海在你眼里就是猪一样的么？这个小万有点腹黑嘛,50,26
冰镇西瓜橘子水,2023-05-02 10:25:15,完全感受不到父女之前的感情 剧情主线就是丈人对女婿的挑刺到后来的满意 那父女之间的感情肯定是很重要的剧情铺垫 结果全程没有描述 就最后的结尾匆匆找补了下 马丽饰演的母亲也是 完全符号化的工具人 张婧仪除了美之外毫无记忆点 没有戏眼戏肉 整部戏看完只记得乔杉那句我特么冻猪肉上了,30,3
vanvan,2023-04-29 23:18:07,3.5,40,5
echo,2023-05-01 17:49:16,有点杂，想说的太多,10,15
逸动控股,2023-04-28 23:48:04,张婧仪真的不是仙女吗我想问？感觉真的是从一出场就惊艳到我了，这样子的美女我真的是狂爱两百遍！,50,37
云初啊,2023-05-05 15:38:52,我实在没看懂女主为什么喜欢男主，男主蠢情商智商都很低还很冒失，为啥不喜欢常远有钱有颜又有上进心还疼人,20,13
土卫六,2023-05-02 22:43:46,电影真的搞笑，是那种很自然的不尴尬的搞笑，从头笑到尾。,50,2
揉蓝,2023-04-30 21:24:58,合格的爆米花电影，虽然故事情节没什么新意，但观影过程还是挺欢乐的。意想不到还有飙车场景，一看原来有韩寒参与监制，哈哈，还是那个赛车少年😂,40,28
折翼的蝴蝶,2023-04-30 19:33:26,笑是笑了，但也不妨碍我质疑故事的设计。哭是哭了，女儿想为父亲庆祝生日的心意。,20,11
未注销,2023-05-06 19:13:40,无论是冻猪肉，横插进来的贾主任，儿时玩伴变假富豪，喜剧桥段都没有真正的惊喜。要不是妈妈和女儿成为最后一个英雄，妈妈这个角色好像都没多大必要。忘记说了，这个女婿没有任何笑点...,20,6
ztlpoppy,2023-05-02 18:18:33,显然这就是中国版拜见岳父大人。居然有点get了范丞丞的颜？这个年纪的偶像派肯露肉的也蛮难得的。大概是年纪大了，看到小星，小爱和最后结尾竟然还有点点泪目？？,30,0
基德,2023-04-30 22:54:17,确实很幽默，然后相亲的时候看的,50,16
ooh,2023-05-06 17:04:57,没什么内容可言 并且非常让人不适,20,4
暴打鹅,2023-04-28 21:05:52,乔杉、马丽、常远、田雨，还有导演易小星，这阵容是喜剧人团建吧！整部影片都没有低俗让人不适的笑点，更多的是生活中可能出现的笑点和梗，抓马又毫无违和感，让人由内而外的感到开心！而且没想到的是常远在片中叫马丽阿姨哈哈哈哈哈哈哈,40,94
隐,2023-05-06 16:49:23,拍得不太行，能卖这么好是不是挺能激励同行？,20,0
不開,2023-05-06 17:41:57,"虽然常远只是个特出，不过真的很好奇常远是怎么精准地踩到烂片这个坑里。除了夏洛特烦恼，真是有常远就烂片啊。
一个公路片，一个亮点的人物都没有。一个喜剧片，唠这么老半天是一个梗都没有啊。",20,9
阿顺,2023-05-01 09:58:59,叫兽依然还是那个叫兽，大鹏却不再是原来那个大鹏。,30,2
阿波罗•尼奥斯,2023-05-01 22:24:55,叙事底层动力不足，女性角色的设计充满了男性凝视。台词设计到上一句猜到下一句哈哈哈，剧情悬浮，人设离谱。五一骗钱电影，真适合在平台上映。,20,9
刘晨辉,2023-05-01 16:19:50,自信，勇敢,40,4
