用户名,评论时间,评论内容,评分,赞同数
Shirleysays,2022-06-20 00:11:55,#??观影# 片子拍的不错，剧本摄影美术、演员状态都不错。美中不足，剪辑太啰嗦，估计一个怕观众看不懂，另一个是故意把观众往沟里带。但是作为不看流量不追IP，看你小成本制作电影的观众，智商都不会差吧。四分之三的时候，我猜到结尾了。所以，故意剪一组带路镜头，显得有点心思太多了。这个电影主题很好：女孩，别怕！期待后作。不是有连环杀人案了吗？主创团队加油！,40,0
何睦,2022-06-23 12:06:00,上帝视角，双线叙事，两条线最终汇合在一起。结构很清晰，拍摄讲究。和网剧《谁是凶手》有异曲同工之处。只是剧本里和主线毫无关系的剧情太多了，打乱了主线的思维，导致主线根本成了一个逻辑上完全不成立的案件，看起来也显得混乱。,20,0
走走看看,2022-12-13 11:08:16,节奏拖沓 逻辑不通 有故意误导观众的嫌疑 但整体影像风格还是很好的,30,0
Do_are,2022-06-18 21:35:16,画面故事没有其他网大的妖艳，悬疑不足，剧情太慢，逻辑没有。鼓励分吧,40,12
破辐,2022-07-26 15:33:51,非常不错，扎实的剧本，真诚的服画道，以及悠远的摄影剪辑，与其说说像《杀人回忆》，倒是更具有锡兰的气质，唯一的问题可能也是最大的问题，就是演员的演技，除了男主外形比较符合角色气质，其他所有人都不在线。,40,1
光影一路同行,2022-06-25 19:11:59,影片完成度很高。年代感和边城气都营造得不错。可惜女主动机成立牵强，编剧还自作心虚一个劲儿借男主口发问她为何要回来报仇。剧作也就现出硬伤。,30,0
局外人psy,2023-02-11 21:56:28,审美在线的作品，已经超过大多数国产片了，有故事也有思考。文艺悬疑片的腔调也足，矫情一点可以理解。剧本层面的故事细节打磨和人设，还可以再精细。,30,0
不爱糖,2022-07-11 18:34:53,"导演已关注，整部影片弥漫着浓郁的日式苍凉气息，风格整体上是世纪末时期的日式电影感觉，取景超级棒。电影色调审美配乐都非常棒，普通演员，却一起完成了非常优秀的作品，五星好评！
我就说，橘色再加一点点，我给12分！！！！",50,5
四月物语,2022-09-06 21:25:37,精致无用 漏洞百出,30,1
熊能能脚不沾地,2022-06-23 11:40:20,我看到了赵丽颖苗苗王阳和方中信??,30,0
法西兰布卡,2022-10-12 09:46:49,属于看到开头就能猜到结尾的，用烂的替身梗。,10,1
hungry,2023-04-30 00:42:05,一眼看到底，但这个摄影和氛围不错，19天搞定的作品？牛xx,30,0
周宇勋,2022-06-28 21:48:01,叫《远山淡影》却不是翻拍石黑一雄，创意上过于局限，某些段落很《芳华》。其实拍「那个年代」的故事没有必要一定要着眼于文工团，太多领域都有很多故事要讲。人物性格塑造也有问题，表演上某些段落偏过，话剧痕迹重（叶硕杨俊皆如此）。服化道等细节处理上有些失真（虽然看得出用过心），台词过于文艺却倒也符合那个年代的气质。结局反转有些创意，但表现手法上欠点火候。总体而言就是部文青拍的「破案片」，有点味道也有弊端，贺泉仍需努力。,20,1
饭舟,2022-12-03 03:37:29,略显稚嫩,20,0
海纳百川,2022-06-21 04:57:50,"山寨伪劣版的杀人回忆加阿婆的谋杀启事，
两个小时就这么没了",20,0
龙小姐,2022-07-17 01:19:26,跳舞想象部分渲染太多，两个人的感情来的莫名其妙,30,0
Muto,2022-06-20 15:08:55,在《远山淡影》这里，陈旧的「直觉」经验与全新的「技术」手段之间发生了不可避免的碰触和博弈。显然，这组矛盾被「同命相怜」感同身受的艺术家放在两名志愿不同而办案风格迥异的刑警身上。貌似占据主导位置的前者实际上已因案件所需事态所迫而被动处在辅助位置上，而作为「中央」领导的左膀抑或右臂，无论是主导性的人力资源，还是辅助性的技术手段，原本也都坐在被「中央」领导的位置——服从组织安排。为此，一开始没有认清形势和自己所处真实位置的投机者本能地将「怀才不遇」主动请缨的「技术」专家视为有可能取代自己「一枝独秀」的竞争对手，而非「携手共舞」合作共赢的同志，而这种「一个萝卜一个坑」内化于心的「站队」文化或是诱导老同志矮化、打压和排挤新同志的潜规则——坐来适意惜日短，主人忘形客忘返。到头胜负置勿论，一笑相看远山晚。,40,3
真不是我没6,2022-07-03 15:12:34,摄影构图和调色加了一星，剧情着实有些平淡，重点放在了姐妹情回忆而不是侦缉推理，即便如此也没能表现出两个女角色间强烈的羁绊，最后的反转并不意外，有点可惜。,40,0
心路飞扬,2022-06-28 09:28:25,有点bug，但总体感觉氛围还不错，如果编剧再打磨打磨就更好了,20,0
心是孤独的猎手,2022-06-21 20:01:44,全是素人，氛围拉满，整体色调阴沉，漫布着雨水，看得出来导演很厉害。,50,5
不笑,2022-08-24 13:51:33,和前一段时间上映的《柳浪闻莺》颇有一丝相同的气息，艺术，友情，破碎，重逢，误会，真相……都在说，初见真好，芳华真好。——2022.6.29看完,30,0
橙小,2022-12-22 15:18:08,觉得把悬疑片拍的美。少讲了罪犯的残忍，更突出两位主角的美，身在泥沼，勃发向上，戛然而止。悲惨得来又没有这么悲惨。,40,1
??,2022-06-21 17:04:45,开始画面挺美的，要是调色更高级点就好了。不知道是摄影师的问题还是导演的问题，虽然镜头是精心设计的，不是瞎几把乱拍了，但还是略做作。不必要的景深镜头太多，并没有形成疏离感，还是不知道疏离感来自哪里，可能和剪辑也有关系，切来切去太快了，显得平庸，浪费了那些精心设计的镜头和调度。草丛里的惊悚氛围营造不太可，还不如《爱死机》第二季《高草地》，甚至和我第一个短片水平差不多，全靠音乐带。表演hin尴尬，看起来故事略《猎罪图鉴》。片名和海报以为是文艺片，其实并不是，看豆瓣介绍是悬疑，其实也不是，惊悚效果较之国内惊悚片还是质的飞跃了，我其实没敢看完，需要看两级纯喜剧压压惊??虽然没看完但也不可能达到4星了，即便后面再不行我没敢看完，在国产惊悚片里面也可以打三星了吧，哈哈,30,0
烟视媚行,2022-11-06 08:55:52,整个电影雾蒙蒙隐在水墨一样的雾气中。故事其实还可以，悬疑感也还可以。但是两代女主实在太像有点让人分不清楚，挺让人困惑的。,30,0
何睦,2022-06-23 12:06:00,上帝视角，双线叙事，两条线最终汇合在一起。结构很清晰，拍摄讲究。和网剧《谁是凶手》有异曲同工之处。只是剧本里和主线毫无关系的剧情太多了，打乱了主线的思维，导致主线根本成了一个逻辑上完全不成立的案件，看起来也显得混乱。,20,0
SleepWalker,2022-07-03 18:58:34,6.5。悬念不够，玩替身是基本盘水平的推理，表演略微低于平均水准，但显然能看到足够的诚意，踏实下来讲故事永远是我评判一部电影的重要考量因素。部分镜头语言，调色不错，文本瑕疵不少，仍在试图努力讲好故事，哪怕笨拙，也值得肯定和鼓励。片尾留个白银案的彩蛋，能拍出来不！,30,0
头大奶大心思大,2022-06-21 00:42:11,还不错 不过情节略微简单 友情提醒 胆小的别看 一开头吓人一跳 总体来说算不错的呢 没什么大明星的情况下拍这样很好了 打个四星支持一下,40,3
EvilGoblin,2022-07-21 18:39:05,“从来没有爱过这个世界，它对我也一样。直到她的出现，把我的世界扯出一道口子，让黑暗从这里宣泄出去，使我不再害怕，一个人独自行走。”,40,0
Arthur??,2022-10-19 09:16:01,你不要影响我看严华跳舞,30,0
Thistles????,2022-09-08 04:38:18,属于那种骂都懒得，最后打了个哈欠的文艺片,30,0
Miss Panda,2022-10-22 21:35:56,拍得很认真，节奏可以适当快一点，音乐与时代有点违和，其他都挺好的。,40,0
Darkmoonlilith,2023-05-03 18:30:42,舞蹈梦想、爱恋执念、友情、连环谋杀、毁容、顶替身份、复仇，画面泛着安静的灰，姑娘的舞姿摇曳渐远，鲜活的历史和消逝的生命，远山淡影,40,1
王小民的吐槽,2022-10-21 21:09:57,一分扣在名字上,30,0
CTfromUFO,2022-10-07 16:52:00,用卧室投影仪看的第一部非常值得的电影，镜头的美与悬念相互衬托，仿佛在歌颂一种神秘的美感，非常令人印象深刻。,40,2
天天天&晴,2023-04-26 21:31:00,服化道还是比较有年代感，演员们全是陌生脸，但是演得也很好。BGM声音太大，有点盖住了片子本身演员的声音。从画师的角度去揣摩案子的情节，有点意思，还是值得鼓励的。,40,0
青麦,2022-07-28 16:06:05,最后反转有点意思。,30,0
朝露昙花,2022-07-26 21:08:08,漏洞较多，可惜了，本来能成为一部国产经典悬疑片的,30,0
梦之安魂曲,2022-06-23 22:38:48,故事一般，拍得不够吸引人，节奏太慢了。,30,0
杨三恨,2022-06-26 00:31:12,镜头可以蛋没必要，故事讲明白单但节奏太慢，逻辑可以但有点扯淡,20,0
hikaruleon,2022-07-02 16:17:46,上半场对脸盲患者极不友好。硬伤肯定有，别往文艺上靠，别煽情，但拍得比较努力，还是支持！,30,0
Tyiya,2022-07-01 16:45:15,优点很明显缺点也很明显的一部国产网大悬疑，其实三星是按照悬疑片类别打的，如果是按照文艺片打甚至能达到4星。以悬疑片来说有一些强制逻辑和为了推动剧情的刻意设计实在是不能忽视的bug，尤其是很多观众也提到的开篇怎样能把一个目击者口中的烧伤脸的人画出模拟罪犯画像问题。但是以文艺片标准来，一句“我来了，时代却走了”真是把全片这种小人物在时代洪流中梦想与人生被击溃的苍凉感拿捏住了，尤其多次提到的上山下乡支援三线建设问题。再就是片子里出现过的三个主要的女性角色命运也让人喟叹，某种意义上说，这片男性角色看完没感觉，尤其男性人民警察们，都是推动剧情的工具人，反而女性角色刻画得让人怜惜共情。这个意义上说这片也是可以打4星的。,30,1
潇潇晴,2022-06-18 21:07:21,是被画风吸引的、故事和节奏真的好俗、慢，哎,30,6
彻夜疯歌,2022-06-23 01:35:09,"7.5
果然，严华没死顶替林音身份，这个影片最大反转影片很早就猜到了，和陈默是连环杀人犯一样，太好猜了反而没意思了。
某些地方略显牵强，不够合理。
总而言之，整体来说差点意思。
最后，这片名不说还以为石黑一雄的小说拍电影了，多少有点蹭。Y",30,1
第十个缪斯,2022-07-01 03:17:29,节奏很好，也有一些“商业片”的元素，自己看完觉得是bug的几处看影评也讲清楚了。确实是网大里的五星。,30,0
莉莉花子,2022-07-03 11:24:22,三星半，感觉还可以,40,1
晓思丽英,2022-06-21 18:13:00,379,40,2
回血小药丸,2022-06-28 11:49:00,起个跟石黑一雄一样的作品名字，真以为是改编。 啥也不是 远山摄影作品展吧 另外收割《猎罪图鉴》粉丝，主创没什么好心思,10,1
DarthVader,2022-06-27 11:43:22,美术和石黑一雄拯救了您这么无聊的故事和表演,10,1
豆乳玉柏麟,2022-07-10 07:39:27,整部電影純粹故弄玄虛，邏輯混亂，漏洞百出，很多情節經不起推敲，那個演章欣的演員感覺傻了叭唧的，那個刑警隊長一天到晚黑著一副苦瓜臉，見誰都大呼小叫，特別是對從上海請來的畫像專家章欣那種態度，我都恨不得把他從手機里揪出來爆扁一頓。全片無論男女，就沒有一個讓人喜歡的角色。甚至片名都是照搬日本的書。劇情挺俗套的，一上來就基本猜對全部內容了。感覺更傾嚮文藝片，但又沒到那個高度，不倫不類的。懸疑劇不能讓觀眾感覺到自己比編劇還聰明，那肯定是不成功的。,20,0
课堂.课本,2022-06-26 02:33:38,两个大的问题：1.过多的情感表达让电影丧失了悬疑片的紧迫感和压迫感；2.悬疑不悬疑，结局太好猜了。当然也有点神话了画像师。,30,0
白洁悉,2023-04-28 20:30:42,飞机上的9个小时没看完,-t,0
人気小圆头??,2022-07-04 13:30:00,你不能说抄一个诺贝尔的小说名就是戛纳片了吧，毕志飞逐梦演艺圈也报名过戛纳呢，真敢发通稿呢。,10,2
無,2022-07-07 13:29:58,为什么部分华语影像特别钟情于点一堆烟然后打大光束，是一种新的恋物癖嘛？,-t,0
ran,2022-07-16 12:32:02,。。这个剧本我真的生气,20,0
nin,2023-03-22 23:41:38,烂。三四流的网文剧本+台词，半死不活的节奏很大一部分是因为叙事视点跟分配的问题，糟糕的道具与布景，有的地方连做旧都懒得做，镜头这方面用得也差，那些长焦真的难看哭了我的妈。,10,1
如果没有如果,2022-11-05 22:33:49,"我以前是逞能，搞什么英雄主义，孤家寡人拼了半辈子，以为能换一方太平，现在看来，像什么都没做，拼命换来的，风一吹就没了。
世间众生百相，哪条路好像都能走，但你只能选择做一种人，无论成为谁，都需要勇气。
这台词，真实地令人叹气。

两个姑娘一起跳舞那里，真的好美，感受到了以前看别的舞蹈没有感受到的美。",40,2
澜旌,2023-02-08 23:08:44,不迎合，不搞什么烂大街的元素，就认真地做自己的个人风格，虽然稚嫩，但值得鼓励。,30,0
seethesun,2022-07-11 16:56:04,原来这个暴躁的队长，嘴里一直嚷嚷的没时间了没时间了，说的是自己没时间办这案子了，胰腺癌晚期。变化有点大，那么多漂亮的女孩的舞蹈队，跳芭蕾的，随着剧团的解散，梅莉竟然以卖为生，，，，有点点的惊悚。悬疑居。照相馆的，因为感情受伤，只要是想离开淮北的女孩，他就给人杀死，，，，第一个女孩，以为后面穿雨衣的人是坏蛋，在跟踪他，向真正的凶手求救，她幸运，跑出去了，这么近的接触，竟然还是没抓到坏蛋。严华为了舞蹈被主任潜了吧，为了林音，放弃自己的身份。一般的电影。,30,0
海盗天台放映室,2022-06-29 01:19:08,"不是说一味地模仿是错，毕竟艺术创作很多时候都来源于经典，但2022年的犯罪题材电影依旧走不出杀人回忆的光环确实也让人不禁有些感叹
美术摄影做的非常考究，故事也很有小说感，从画像师的角度来展开谜团其实是有噱头的，可怎么说呢，就是太流于表面，做的全部都是拿来主义，甚至调色人物设计也是按照杀人回忆的框架来的
这就导致好好一个犯罪题材，非要在文艺感上做文章，最终的结果就是四不像，并且稍微看过点同类题材的朋友在我还刻意看了一下进度条的第20分钟，我相信大家已经对凶手也好，结果也好，都猜的八九不离十了，这一点来说，你其他边边角角部分做的再好，也失去了它本该有的光彩，特别是明明50-60分钟就可以讲完的故事硬生生拖到120分钟，太磨叽了！！
值得鼓励的事，尽管对爱看电影的朋友不感冒，但在网大角度确实可以了",30,0
唐玉小业,2022-06-26 19:57:16,光与影，画面与调色，超出了一般院线电影的水准，质感一流，细节丰富，唯一大家比较不满意的可能是案件本身的动机与人性的剖析，但跳出传统的分析框架，这部电影的细节展示还是很耐人寻味的。PS：这不仅仅是低配版猎罪图鉴，淮川版杀人回忆，它反映的文革末期到改革开放初期人们对美好生活的渴望，在那个年代彰显的意义更像是白日焰火下的东北下岗潮。,40,8
东方小奕荣,2023-02-07 23:18:31,居然是2022年的悬疑片，还以为是很久以前的老片呢，画像师太牛逼了！,30,0
道友请留步,2022-06-22 23:53:17,摄影挺好的，破案的片子拍出这种感觉少见，有点太文艺了，节奏再快点好了。,40,3
9o1o31,2022-09-21 08:57:58,做为网大来说还行。画像师被巧妙的安排成了通灵者，虽然没明说，这个设定其实挺有趣的，但对于可以随便演鬼片的外国来说，就没什么意思了，国内的观众还能会心一笑。有点出“潜规则”对女性的伤害，但是因为后面还有杀人什么的，这些就被淡忘了。。。。,30,0
南方,2022-06-23 18:31:34,还行吧，作为悬疑嘛差了点，作为文艺片又差了点。,30,0
Marvin Comte,2022-06-18 22:44:15,要看两遍,40,8
伏案夜梦,2022-06-22 00:42:49,标准国产悬疑文艺片，类似的有《暴雪将至》《白日焰火》，质量介于院线与网大之间。几场镜头极美，导演若有新片也会看。,30,1
momo,2022-07-15 12:35:35,故事一眼看到头，演员男一男二都有点出戏，但是画面调色和摄影很棒很喜欢，本身比较吃这类悬疑片吧,40,0
hedgehog,2022-07-08 16:04:06,节奏和意境都很不错，演员也选得蛮好，没有一个熟人更容易进入这个故事。,40,0
侠茨杰拉德,2022-07-04 23:33:05,没有队长癌症那段，评分可能会涨,30,0
壹壹,2023-01-29 18:27:59,"文艺片?悬疑探案
居然能展现
当然推出来了，铺垫会重复出现
女生跳舞真的好好看哦",50,1
enigema,2022-06-21 22:02:52,几乎没有网大的感觉，和石黑一雄的书有相同的精神内核，一个人真的可以成为别人吗？不苛求的话，所有部分都做的很好，旧日的年代感，电影中不断涌现的哀伤情绪，这只是导演的第二部作品，未来不可限量，五星鼓励。本质是一部文艺剧情片，悬疑的部分也解释的足够，最后的反转可以说是一个不在场证明的经典例子了。,50,5
小狗啃纸,2022-11-20 17:58:56,"勉强7分
画面很美 故事也很美 虽然有细节 但撑得不住整个故事 显得剧情很多地方不合理或者很刻意",40,0
张多拉,2022-10-18 22:28:20,中规中矩，好的是服化道及摄影，差的是故事略显平淡，缺乏深度，2个小时有些长。,30,0
浪味仙,2022-12-20 17:08:51,披着犯罪悬疑外衣的文艺片。题材类似《杀人回忆》，剪辑上像《薄荷糖》，追枪贩的时候又有几分娄烨的味道。固执的老警察，带着主角光环的画像师，老警察坚持的破案关键是凶器，可这最关键的证据来源并没有表现在推理或刑侦上。所以企图当成悬疑片来看的话定会大失所望。,30,0
Rosenmont,2022-11-05 20:55:05,好尴尬的台词和演技，泄气的剧本。除了摄影中的空境，其他部分全都是国产片的通病。,20,0
Pint,2022-10-03 23:38:38,只能说电影名挺清新的,30,0
赛东施,2022-07-05 14:47:39,一堆漏洞，逻辑差的要死还故作深沉，无病呻吟，呸！,20,0
一只猪头奥,2022-12-16 10:47:03,文艺片可以，悬疑片够不上，bug 太多,20,1
李玄贞,2023-04-05 22:14:28,在那个物质匮乏的年代，文工团简直是文艺工作者的职业天花板，尤其还是首席，怎么可能会有人为了成全别人的理想，轻言放弃？,30,0
jinbo6995,2022-06-21 23:55:48,我只想说！这部剧给3星以下的，丧心病狂！！！,50,6
Evan,2023-01-02 15:57:25,这片不错的，值得静下来一看。四星有的，多给一点拉一下。,50,0
豆友56157350,2022-07-19 20:41:25,"喜欢里面的景，喜欢里面的台词。
“人生像一条夜河，你在其中湍急而过，任你如何努力，都无法在最喜欢的地方停留。”
“世间众生百相，哪条路好像都能走，但你只能选择做一种人，无论成为谁，都需要勇气。”",40,1
D伯爵,2022-06-22 22:09:31,很好啊，色彩很有年代感，猎罪图鉴电影版,50,2
红拂夜奔,2022-07-09 21:31:32,再打磨打磨还能更好一点。,30,0
Maybe,2022-11-28 10:45:57,构图和光影真的太舒服了，光影下跳舞的镜头美翻了好嘛！,40,0
ricqles,2022-06-21 22:22:42,【5/10】氛围、摄影都对了，可惜实在太多bug了，既然是一部悬疑、刑侦片，实在无法忽视。大半夜，嫌疑人面目全非，竟然可以根据目击证人的证词画出精准画像，真的不科学；走私枪支的案件的插入，过于工具化，就是为了推进剧情而突然插入；还有严华发现林音尸体立即掩埋而不报警，也说不过去。不过，至少路线对了，如果能够好好打磨剧作，会是一部佳作。,30,0
Alary,2022-10-21 13:19:39,一种怀旧的美感，意境很棒。悬疑和反转还不错，节奏比较慢。,30,0
