用户名,评论时间,评论内容,评分,赞同数
小小朱尤莉亚,2023-01-23 13:25:48,"#水之道8分深海只有7.6我不服 某瓣评分崇洋媚外实锤
写在前面：如果你只想过年图个乐呵，那我劝你别去，不然就会像某瓣上某些脑残恶评说看了两个小时的晦气。
这是一部献给抑郁症患者的电影，扩大点范围来说，是献给所有有抑郁情绪的成人的电影。不适合带小朋友，小朋友也看不懂。硬伤没什么好赘述，能改进的地方确实还有很多，但不能掩盖精美的画面、工整的故事以及温暖的内核。田导潜心七年讲述了一个他想说的故事，这故事不是商业化的，无法讨好大多数观众的口味，只能抚慰一小部分人的心灵。比如最后在电影院哭成🐶的我~
我既希望所有参宿能有一个南河，又不希望参宿们必须经历南河之后才走向坚强。不要贪恋内心的色彩斑斓，外面的世界虽然灰暗，但总有一束光能照耀进来。
致敬所有走过长夜的我们[爱心]",50,379
钰钰怪,2023-01-24 19:54:35,发出来不怕被别人踩。女主被妈妈抛弃，那为什么妈妈这种独立女性非得等到孩子跳海才回来陪伴呢，为什么不把女主带走呢？中间那段描写后妈和重男轻女的，真的超级恶臭。连妈妈这种x色体都不girls help girls，还要指望一个八杆子打不着的y色体小丑来拯救自己，果然墓妊总想着y色体来接盘，差评了。,10,552
夔宁,2023-01-22 11:47:51,这部片子是我唯一一个不知道该怎么评价的片子。很吃受众，也极有可能很两极分化。画面做的很好，剧情也不错，可能跟个人经历以及共情能力有关。我从前面眼泪就有点控制不住，不知道具体是什么点，就是眼泪一直掉。到后面有点泪失禁了，哭了半卷纸，哭的我脑子疼。觉得这部片子对于我来说是很值得看的，虽然排片真的很少。但我可能不敢二刷了，带来的后劲太足了。,50,569
林哲_林哲,2023-03-29 23:06:32,一坨五颜六色的屎,10,156
Moran_,2023-01-23 15:50:35,能不能花动画十分之一的钱找个读过书的编剧？,30,594
🐼,2023-01-29 00:47:21,大家为什么不愿意对深海多些宽容，至少并没有你们说得这么差劲，这甚至是我进电影院以来看过的最好的国产动画，从画面到立意再到叙述方式，前面根本就不会沉闷，你需要看进去就会了解女孩的心思。,50,336
桑瑜菲晚,2023-02-09 22:33:12,这不是春节档最好的电影吗,50,216
文森特九六,2023-01-22 11:34:29,一部在并不成功的动画演出新技术实验和急于使用种种精神心理疾病的经典案例符号进行具象化诠释扣题之间迷失了根基的遗憾之作，一切皆为服务于叙事，然而“讲好一个故事”恰恰是本片最为缺失的致命一环。无论是A故事还是B故事，人物之间情感关系的起承转合都是十分残缺和莫名的，核心问题在于谜底的揭开被放置于视觉高潮之后，因此真正的情感高潮也被滞后，于是本身就并不完备的角色以及随之产生的唐突弧光所造就的奇观就显得非常扁平和乏味，然而当情感高潮来临却又仍要坚持继续捆绑着先前情节上已然破碎和失真的人物羁绊而使得全片陷入了硬性煽情的尴尬境地。对片中所提及的相关人群当然值得关怀，也相信部分观众是真心有所共情共振，但很难不想到庵野秀明与EVA之间的对抗和疗伤，可能田晓鹏也在本片中治愈着自己，只是他或许仅做到了同自己和解。,20,514
Azul7,2023-01-29 19:11:18,我第一次觉得这分是因为大家对国产动漫太宽容，狗屎，一坨狗屎。,10,350
南音,2023-02-07 18:13:05,我完全不觉得故事没讲明白，他从海里救下了参宿，讲了很多故事激起我的求生欲，后来终于有船经过，可是在这最后的的时刻我再也坚持不住了，他再次救下了我，可他却再没能回来，再失去他之后，在生死夹缝之间，我做了一个梦，梦里他的故事成真了，我的负面情绪变成了丧气鬼，我的欲望变成了海精灵，开始我的海精灵代表着找妈妈，可是后来为什么海精灵会变成代表南河?在深海之眼的最后我鼓起勇气突破了丧气鬼的束缚，可是南河还是消失了，化成了彩色的碎屑，我终于想起来了，为什么在梦里本来是妈妈的海精灵，却变成了南河的海精灵，因为我的欲望改变了，“我想要南河回来”,50,215
Maki,2023-01-29 13:11:52,"如果可以打0星的话……吵，满格彩色，哈尔的移动城堡，千寻给河神洗澡，艾莎公主找妈妈……后半程看出来是精神病的自我世界，为赋新词强说愁！不给我退钱真的很难不生气！",10,244
一灯,2023-01-22 11:08:44,少女参宿的奇幻漂流,40,478
ミドリの空,2023-01-24 18:02:44,当理解到这一切都是幻想时就猜到了。评论里好多理性人来分析剧情抨击画面，可是这部片就是试图用高饱和与混乱的深海将梦的超现实表现出来啊。应该早些注意到的，参宿四、南河三，以及在分割着二者的银河中的天狼，某种冬夜的暗喻。潜意识里塑造的女性都具有着母亲的特质，而男性的丑恶、理性和趋利都是对现实的反应。南河作为长发男或许也中和混杂了某些性别气质，很有意思。只是真正的患者是能够自洽的吗？梦中真的能自我救赎吗？我想能拍到这步的导演应当是没能扭过审查大爹的意见吧。很可惜，梦醒后又是一个破碎灰暗的现实。散场后也是。,40,464
沸海鲸歌,2023-04-02 20:19:17,我像被五彩斑斓的大鼻涕甩了一身，然后被扔进花花绿绿的危化品废水池泡了两个小时。,20,118
浮游剑鱼,2023-02-05 17:04:48,里边的角色仿佛都得了狂躁症、多动症般浮夸、变形；美术，想做成极繁主义般绚烂目不暇接，实则湿答答、黏糊糊、脏兮兮、光污染且拥挤到令人窒息、反感。但这些都不是我最讨厌的。讲好了故事比什么都重要。“吃了题材的亏”是某些常用说辞，然而题材能代表什么呢？剧情和人物刻画恰恰是深海最薄弱的一环。脸谱化、刻版化、套路化等通病一个不落下。不好看，不推荐。,20,237
飞行员大副,2023-01-26 19:06:36,片子没有戳到我的泪点，对于南河被献祭，我不是感动，是感到可怜。跳出来看，你会为了一个抑郁症小女孩去牺牲一个为了生活努力打拼的年轻人吗？,30,359
一只空气炸鸡腿,2023-03-31 20:58:46,导演要是嫌钱太多，可以把做特效的钱拿出来请个会讲故事的编剧，动不动就要画面推进剧情是怎么回事？整个故事莫名其妙，人物行为毫无动机，想模仿千与千寻和炒网络爆梗的心太明显了，仿佛在看干与干寸，导演别卖惨了，这片子能有这票房还是还惨，那其他电影都惨死了,20,108
偏执的猫,2023-01-31 00:35:38,满江红罪加一等,50,229
广末凉茶,2023-02-11 00:12:03,动画电影什么时候才能“断奶”啊！要么就是找妈妈要么就是找爸爸，然而参宿需要的，是关怀是爱啊！这完完全全给跑偏了嘛！“深海大饭店”明摆着就是千与千寻“汤屋”照搬过来嘛，参宿的形象也参考了荻野千寻（某些时刻某些动作简直像是附了体一样）。但起码千与千寻里的人物是有所成长的，而本片更像是“强行疗愈”。原生家庭、抑郁症……那么多苦难，真的就只是笑那么一下就能释怀得了的吗？电影制作七年，只是缝缝补补东拼西凑，借着“抑郁症”想搞些深意，披着五彩斑斓的外壳想摆弄那“精湛技艺”，很可惜，深意不够深，“精湛”的画面也只是辣眼睛（我戴着3D眼镜难受得啊）。“看得出你真的很努力了”是我对目前国产动画的评价，确实憋了一股劲，我也看到了，但这评价并不带一丝褒奖或是慰籍，而是换一种形式的“失望”。,30,199
多喝水,2023-01-23 14:15:23,我搞不懂，你田晓鹏能用最好的制作，受着这么多观众的期待，花这么多时间金钱人力，竟然能做出这么拉胯的片子？整个创作过程中难道团队里没有一个人站出来指正过这片子缺点吗？镜头运动设计得稀乱，聚焦从头到尾迷之模糊，角色动画充斥着没必要的夸张形变，这些东西叠加到一起就是一个字：晕，就不能都安稳点，好好表演好好叙事吗？配音和混音也是乱得一塌糊涂，从头到尾聒噪得很，连基本的空间远近层次都是乱的。故事方面吧迪士尼皮克斯就别提了，离麦兜都差了十万八千里，真的是浪费资源。,20,553
亵渎电影,2023-01-23 18:56:15,《深海》让我想到《少年派的奇幻漂流》，前面一个多小时里，色彩绚丽的深海世界都是女孩内心的投射，这个世界里的角色、情节、道具和冒险的设计都是女孩脑海里的事物幻化出来的，是一个展示女孩战胜心魔的过程。你在看片的时候，可以把注意力放在女孩跟母亲有关的台词和噩梦上，留意女孩身边的一切。进入深海大饭店之后，你就可以自行对应上很多细节，参与到故事里之后，观影乐趣会暴涨。就算你不愿意主动参与，也没有关系，电影的最后导演会用一连串的蒙太奇镜头帮你一一对应相关的故事情节。《深海》虽然是一部动画电影，讲的却是儿童抑郁症，导演干了一件现实主义题材的真人电影都不会干的事情！很久没见这么剧本扎实的国产动画电影了，我觉得今年春节档能靠口碑逆袭的票房黑马，肯定是这部动画电影了！,40,246
革威底,2023-01-22 18:21:50,看预告以为这是国漫崛起的希望，实际上是死猪不怕开水烫。,20,687
Obukuro,2023-01-24 16:43:56,实话实说，当电影里角色说出抑郁症的时候，我情不自禁地竖出了中指。还有不是绚烂的色彩就是高级，美是内敛的，不是五彩缤纷的，你能用一次，不能每次都用，真是视觉污染。丝毫不觉得所谓粒子特效有多么神，男女主的cv让我听觉不适。从头到尾依全是依托答辩！,10,488
Drizzle,2023-01-23 02:16:42,创作真的不容易吧，唉辛苦了，加一星给创作者和美术。虽然残忍，但事实证明，太多华丽炫技便损耗诚恳，填得太满便过犹不及，只有设定和立意、却没有扎实的血肉和铺陈，就无法让人真正相信和共鸣。看海报以为会是美和细腻的故事，却变成在肤浅无厘头的眼花缭乱中头晕和失去耐心。把立意分析得再好、价值上得再高，都不等于故事实际真的打动人和令人相信。什么都不如扎扎实实把故事讲好。|第一次在电影院如此如坐针毡。片头绚烂的海底美得令人感动，片尾的手绘和画册也舒服诚恳，但正片本身却无奈地令人失望。深海饭店少女冒险像千与千寻，梦的碎片拼接像穆赫兰道。小胖猫和水濑挺可爱的。,30,402
萌特斯,2023-01-29 21:50:36,没想到这么克系，看某些场景的时候一直在脑补如果拍一个恐怖动画应该会非常不错。剧作挺私人的，但了不起。老金是爸爸，花花是后妈，抱球海狸是弟弟，这都很明显，所以南河当然不仅是南河，还是原生母亲的投射。海精灵是欲望，引诱人下坠，红色物质是可吞噬一切的消极深渊，参宿希望有人从消极深渊中救出自己，她将这希望寄托给母亲，但最后她发现如果要达成自己的愿望，就会牺牲南河（即寄望母亲回头，会毁掉母亲目前的生活/幸福）……不是我说，让一个才这么大的孩子做电车难题是否太过分？故事到这里戛然而止，没有给出选择。被南河救起醒来后，参宿看似被治愈了，被注入快乐的希望了，电影有了一个光明的结尾与片尾，但恐怕没有人觉得她会真正被治愈，相反……既然她是一个连母亲都不忍打扰的善良孩子，南河之死所造成的负疚感只会更快加剧拖垮她。,40,297
去码头整点薯条,2023-03-13 12:30:21,➗生玩意,-t,3
pipodream,2023-02-05 23:30:31,看完深海给我的感觉就是，一个差生想用华丽的词汇和丰富的语言想写好一个故事。,30,140
时叁,2023-03-04 19:38:25,打分低的观众们，我想你们应该都过得很幸福，每天都生活在阳光下吧……好几次的感同身受让我无法客观的给出评价…当小女孩发自内心的快乐时，我很害怕..害怕她的这种快乐转瞬即逝…南河就是她，她就是南河，能真正解救她出来的只有南河（她自己）…最后，“散场了，该醒醒了”（这句话有调侃的成分，可在我看来，是导演，是我，对自己接下来的新生活的一种自我鼓励方式吧……）这是至今为止我看过的最好的一部国漫，必须是五星大饭店。,50,162
留我在梦里,2023-03-26 18:38:43,"这海报很漂亮啊，但莫名有点像大鱼海棠?
很期待啊，我也很爱大海。

看了姜子牙后面的彩蛋，制作太惊艳了。


终于看了，但真的对不起我期待那么久。画面五星，剧情三星。看之前就知道是讲抑郁症的了，所以光怪陆离也能接受，但就是不好看，剧情混乱，人物立不起来。适合当壁纸，跟当年的大鱼海棠一个毛病。",40,5
塔塔君Minkun,2023-01-29 09:46:40,动画必须时刻动起来、必须有变形的永动魅力、必须要拍实拍无法拍出的风格和效果，这三个关于动画的偏见，本片可以说是占满了。青涩的动画作者获得最好的技术加持后，毫无节制地在每一秒、每一个颗粒做加法，以及毫无节制的浅景深、前景遮挡导致信息无效传达。与其说他不晓得何为动画的静止美学，不如说他甚至不晓得动画为何而动。若说被这些动势模糊掉的世界展现在本作并不是那么重要、因此不需要一个大全景的话（有人会说毕竟这是主观而无法解释的梦境），那为何要依赖拖沓又看不清信息的长镜头跟随角色游走船的内部？就连海精灵追逐、丧气鬼入侵等戏码都不愿意给个稍全的远景镜头？可能这是春节档最有人文关怀的电影，但也是视觉上最污染眼睛的电影，本作上线流媒体的话，一定会因为国内流媒体的低码率糊成一片。,20,148
时叁,2023-03-04 19:38:25,打分低的观众们，我想你们应该都过得很幸福，每天都生活在阳光下吧……好几次的感同身受让我无法客观的给出评价…当小女孩发自内心的快乐时，我很害怕..害怕她的这种快乐转瞬即逝…南河就是她，她就是南河，能真正解救她出来的只有南河（她自己）…最后，“散场了，该醒醒了”（这句话有调侃的成分，可在我看来，是导演，是我，对自己接下来的新生活的一种自我鼓励方式吧……）这是至今为止我看过的最好的一部国漫，必须是五星大饭店。,50,162
pipodream,2023-02-05 23:30:31,看完深海给我的感觉就是，一个差生想用华丽的词汇和丰富的语言想写好一个故事。,30,140
HOBBS,2023-02-03 14:31:14,球球国漫不要再追求视效了，真的已经够用了，分出点钱来找个正经编剧吧！！！！！！！,30,170
Obukuro,2023-01-24 16:43:56,实话实说，当电影里角色说出抑郁症的时候，我情不自禁地竖出了中指。还有不是绚烂的色彩就是高级，美是内敛的，不是五彩缤纷的，你能用一次，不能每次都用，真是视觉污染。丝毫不觉得所谓粒子特效有多么神，男女主的cv让我听觉不适。从头到尾依全是依托答辩！,10,488
宜乎众矣,2023-01-25 20:28:27,前90分钟两星。世界观的引入和人物的塑造都过于潦草，故事发展非常儿戏且看不到一个有力度的主题，迫不及待展现技术却暴露出各种不用心的地方：用了很多长镜头式的表现手段但深海大饭店的空间结构依旧无法清晰呈现，极尽所能创造宏大场面却用空间感扁平的长焦镜头捕捉具体的人物，动作场面因水墨背景画风与3d人物动作的不协调造成速率的失衡。没想到结尾10分钟力挽狂澜，在一个极短的瞬间内道破一切故事的根源，以气力万钧的剪辑调动起观众的情绪，用应接不暇的前后呼应收束起所有的模糊比喻，让这虚伪荒谬的宏大冒险踏实而有力度地回归于细腻的人文关怀——这一切不过是一个孩子放逐自己的乌托邦，她的心智就像影片前90分钟一样，幼稚、没有方向，但始终怀揣着五彩斑斓的希望。这般明智的视角回归，让这碗冲破黑暗、拥抱现实的心灵鸡汤足够动人,40,174
普通豆瓣用户,2023-01-26 22:11:32,"最搞笑的就是最后那个“醒醒吧散场了”，堪称春节档最佳总结奖，既然你们知道观众要睡着干嘛不好好写下剧本啊……
我对睡着两次的朋友说“还是蛮有自知之明他也知道观众会睡着啊”，后排男生附和道“对头，我也睡着了”",30,300
厌晨欢,2023-01-25 17:13:58,"南河这个角色很妙，他有时候是追逐名利的俗人，有时候又是忧郁的是会讲五颜六色的故事的，他做创意菜却不被理解，他追求五星好评却永远实现不了。直到他看到女孩落海而毫不犹豫地跳了下去。或许，他只是想救一个溺水的自己。
“因为我是萨摩耶，我生来就这样啊”",50,332
Amour,2023-01-22 20:24:44,"找妈妈的故事×
找南河的故事✓
前半部分=五彩缤纷的依托答辩
后半部分=抑郁症符号的胡乱拼贴
《千与千寻》+《红辣椒》的低配一锅炖大杂烩，故事与设定不如前者、叙事与意象不如后者",30,337
Summer,2023-02-11 21:01:26,凡是收割到本人眼泪的一律按照五星处理,50,185
这里有个球,2023-01-24 13:47:13,太残忍了，把五彩的梦碎掉给你看，还叫你要往前看。,50,298
Moss,2023-01-27 16:35:05,不是画面花里胡哨就显得高级，也不是剧情搞搞意识流就可以称之为艺术的。作为一名曾经的抑郁症患者，至少从我自身体验来说，抑郁症患者的形象绝不是电影里刻画的那样自卑敏感和害人。另外想说，建模稍微好看一点吧，我的眼睛也很珍贵，受不好一直看两张丑脸的面部特写镜头。,10,372
Flood Dragon,2023-02-07 19:51:20,"海精灵——《幽灵公主》邪神

深海大饭店——《千与千寻》汤屋＋哈尔的移动城堡

田鼠——《千与千寻》煤小鬼

老金、阿花——《东京教父》

劈海——《加勒比海盗》

深海之眼——《天空之城》

挤破幕布——《红辣椒》

叙事架构——《少年π》＋《潘神的迷宫》＋弗洛伊德

再叠上东亚女buff＋抑郁症壳子＋网络鸡汤

合着梦境是个筐呗，啥都能往里装",20,137
养生,2023-01-25 22:21:45,难看到哭，毫无逻辑的情节，无缘无故的爱和恨，没有根只有矫情的人物，抑郁症的设定成为了人物设计上的最大败笔——悲惨的家庭、孩子的丧气之举和抑郁症之间的因果关系到底是怎样的？两个主角的活动线一个是找妈妈一个是赚钱，结果告诉观众这是将死之人的幻觉，把前面所有的人物动机和剧情全推翻了，妈妈也不找了钱也不挣了，我一个多小时看了个啥？一场梦，多低级的剧本！制作出来的奇观的确让人震撼，可是看太多就让人眼花缭乱，审美疲劳。南河是好人吗？是也不是，大家不是因为他是个好人而哭泣。“人之将死 其言也善”，只靠这一句话是打动不了有脑子的观众的。赔钱！,20,310
猫猫头山,2023-04-04 15:23:35,没看懂女孩是怎么走出抑郁的，想见的人没见到，想救的人为了救自己死了，光想想就很地狱,30,83
翎上,2023-01-23 12:50:49,=《千与千寻》+《少年派的奇幻漂流》+《哈尔的移动城堡》+《海洋之歌》+《泰坦尼克号》。整个就是一场濒死体验。对于抑郁的表达我非常不同意，电影完全不允许不快乐的存在，劝你要看开要相信希望，要与世界和解要与自己和解要接受现状，可这才是病态。三幕剧的格式，成长、原生家庭的主题关注儿童心理健康的呼吁是符合当代价值观的。参宿属水，以及动物与身边人的对应这都是亮点。剧情的破碎没有逻辑，以及用缤纷的视觉设计来呈现这样一场抑郁自杀后的濒死体验反倒有一种悲剧感，是电影最突出的优点,40,188
CARSON,2023-02-15 00:15:12,博士后的技术，小学生的剧本。,20,121
龙战于穹野,2023-01-22 14:52:03,南河好像齐天大圣啊！他是那么温柔，就像我心中永远的大圣。愿所有被伤过的童年能走出阴霾,50,276
shiningstar,2023-01-26 07:19:34,决不鼓励这种只靠特效忽视剧情的内核自我感动式烂片。,10,335
兰章玉砚,2023-02-13 12:25:52,男主真的是太丑了，嘴巴可以咧到耳朵根、眼睛可以瞪出眼眶，就是在最后像一个正常人一样和参宿说话的时候他的脸也是像一团果冻一样甩来甩去的，加上电影里面的各种屎尿屁元素，比如在洗脚盆里煮起来的海精灵疙瘩汤、用痰盂装疙瘩汤、黏糊糊的丧气鬼、充满了粘液而且晃来晃去的各种菜品，导演可真喜欢在观众的审美点上蹦迪，想方设法的把这些东西做得足够恶心，五彩斑斓的💩也不过如此，使用舌尖上的中国里的配乐简直就是对舌尖上的中国的一种侮辱。第二，请不要营销什么粒子水墨，麻烦主创好好看看中国的水墨画应该是什么样子的，你这明显的油画风格还是别碰瓷水墨了。第三，请不要消费抑郁症了，我有一位有轻微抑郁症的朋友看了之后并不觉得治愈呢，如果抑郁症患者这么容易就能被拯救也没有这么多抑郁症患者自鲨了，这种一命换一命怕是更致郁。,10,147
Alien 33,2023-01-28 12:04:07,老zhong是不会塑造除了 沈腾式表面爱财内心保有一点善良 以外的任何男性人物嘛✌画面非常精美，但是为什么内核老是这种被这种破男人拯救的故事？参宿结尾在虚假的妈妈幻想中选择了冲破牢笼，和真实的爱他的南河醒来，但是为什么东亚女非要在真实和虚假的爱中选来选去，而不是自己爱自己呢……最狗屁的就是你打着关爱抑郁症患者的旗号，内核还是从外界寻求爱，而不是自己真的值得被爱，学会自己爱自己。剧情拖沓节奏混乱，编剧也觉得说不通吧喝喝。,30,192
Ｒ．ｒ,2023-01-30 19:46:04,谢谢田晓鹏导演的一场梦，前一个小时头一次让我感受到呆在电影院里是如此的难受。,20,220
momomomo,2023-01-27 18:05:55,画风确实是非常不错，能给我美的感受，后面是关于电影的思考。能看出来导演是在造梦，造一个名字叫救赎与寄托的梦，最后一行字“献给走出长夜的你”，这里我认为导演其实是不怎么懂走出长夜的，以至于他的叙事还是偏向于造梦，我是自己走出过长夜的人，那些真实的伤痛是靠意志力，靠独立思考，靠一步一步坚持，可以说走到今天是极为不易的，我理解的走出长夜大概应该是小女孩站起来的心路历程，并不是说期盼救赎不对，只是说太过梦幻太过童话，显得辜负了我们奋力走出长夜这一路的风景，前方并非光亮坦途，途中不会有小丑拉你一把，回望这一程，你依仗的，你拥有的，都是你的那颗心，那颗勇敢无畏，坚韧的心。,40,125
提丰,2023-03-25 17:27:48,一坨精雕细琢、五颜六色的大便。元素堆叠、剧情生硬、画面过于眼花缭乱。导演，实在不行你把男主角设计的好看一点吧，换成一个美少年我还有看下去的欲望，您的偶像宫崎骏永远不会画这么丑的角色。,20,100
猛火里睡,2023-02-05 18:12:17,建议导演跟编剧给美术磕个头吧，不强行煽情不会拍了是吧,30,110
Miss Bee,2023-01-25 17:53:49,题材是很好的，但是故事讲得不好，尤其是奇幻部分，节奏不佳人设单薄，拖累绮丽的画面。小女孩和男主的感情建设很莫名其妙，忽然间就有羁绊了的感觉。现实角度故事也不讨喜，有这个样子的父母小女孩抑郁是非常正常的，要拯救一个抑郁症小女孩连累一个无辜的人死亡真的是……大过年的……何至于此……,30,174
黑灯,2023-01-30 00:01:11,总觉得这种尬是国产独有的，老毛病:总想用一部片给你灌输n多道理，但没一个经得起推敲。堆料于我而言是没有用的，五彩绚烂的图像冲击十足但特别具象，没觉得有什么想象力可言。这些春节档注定会被埋没在影史长河中无人提起。电影（个人观点）的脊梁从来不是技术。,20,215
Unhinged,2023-01-24 11:04:17,如何讲坏一个故事？这个电影把近几年中国动画的毛病都集中到了一起，特效炫、台词尬、人物虚、情节乱，最后还要强行来个煽情大高潮。,20,331
