用户名,评论时间,评论内容,评分,赞同数
JoniJerry_HJN,2023-03-30 21:09:16,故事真的不是这么讲的。一个半小时的绚丽画面没有任何实质性的行动，最后半个小时的反转只是强作解释，真的看得没有任何波澜。,20,52
laka,2023-04-03 21:48:44,说真的如果我害死一个陌生人可能抑郁会加重…  真心希望剧本不要这么想做抓马而是更加细致的描绘心灵的碰撞和一步步开放。而这样需要更多的笔触放在现实世界而不是梦境，所以剧本在合理性上感觉是失衡的。,30,45
DeckardYang,2023-01-23 10:57:13,【4】真诚是很可贵的，即便调动的一切并不超出预期，而有了技术力的加持，才真正成为一场盛宴。恍惚间甚至找到了当初看EVA时的震颤，在不同时代、不同语境下碇真嗣的出现，见证我们一戳就破的甜蜜。,40,48
A回收旧家电,2023-02-02 17:24:41,不要再卷画面了，把剧情讲好吧，谁看电影是为了看美术啊？看电影的时候感觉我和我妹妹有代沟……,20,95
夜小西,2023-02-02 21:58:55,又尬又低级  感觉评分都刷出来的,10,166
不成眠,2023-01-25 01:42:59,感谢导演给晦暗的心织就这幅绮丽的美梦。有人说如果一部电影只有抑郁症患者可以共情，那不是失败的嘛？有没有一种可能，是我们被忽略得太久了，第一次被这样毫无保留地拽到阳光下感受别人习以为常的温暖。喜欢的电影可以有很多很多，但想要对导演说一声谢谢的，就是《深海》。谢谢你，看见我，洞穿我，代替我沙哑的嗓音引吭高歌。深海之中或许有惊涛骇浪，但太阳照进来也可以五彩斑斓。,50,127
山721,2023-04-02 23:42:09,这画面风格和动画质量完全配得上讲一个更好的故事……,30,39
枢汩特,2023-01-28 21:31:12,难看得想跳海。剧情就是一坨浆糊，再添上一些自作聪明、有头无尾的感动片段，我完全不懂影片想表达什么。画面也许是精美，可真正有美感的片段不过片头以及片中丧气鬼爆发这两段，其他的都太满了，以至一片混沌；毫无克制的猎奇大特写毫无幽默感；造型以及场景设计完全是为了创意（一定要制造出点什么）而创意。观影全程在犯困、迷惑以及愤怒这三种状态当中切换。,10,149
游冬·贾真,2023-01-24 14:54:47,整个人哭成傻子。你一定想不到抑郁症患者的世界色彩太炫烂了。我们不要害怕。 心目中国产动画第一。,50,150
Rain,2023-01-24 13:37:38,在昨晚如坐针毡的看了三个小时的缝合怪之后，大早起没什么情绪的去电影博物馆看了深海，没想到电影结束走出影院还没办法醒过来，泪流不已。愿称这样的电影为中国电影工业的飞跃和骄傲。迷幻绮丽的视听艺术，中国风的水墨美学和技术突破，真正无国界的人文情感内核，故事和技术相得益彰，透过这部电影能看到导演和幕后团队柔软诚挚的真心。有时候我们是参宿，有时候我们也是南河。对我来说，南河是大圣，是田晓鹏，是周星驰，是治愈过我们的漫画和电影，是保卫我们精神家园的文学，是拯救过我们、在溺水时拉过我们一把的人和事。很幸运，我也拥有自己的南河。因为有ta，我的笑是真心的。祝贺中国动画有这样金子般的心的人才。希望这部不是特别适合春节档上映的电影能慢慢走出长尾，希望在国际市场上也能走的更广更远。,50,159
江畔荼蘼白,2023-02-11 21:04:50,前段时间确诊了重度抑郁，看这部电影前有些犹豫，但表妹想看，还是陪着看了。情节确实比较单薄，但是对于那种被“丧气鬼”追逐、缠绕乃至包裹的整个过程，画面和配乐的感染力太强了，太深有体会了，以至于在电影后期泪流不止，打湿了口罩。看完表妹问我“南河是不在了吗？这是个bad ending吗？”我说“不是所有故事都有happy ending”。希望自己能够早一点走出来，找回从前的自己。,40,55
Delia,2023-01-22 16:50:37,你们欠郭敬明PPT电影一个道歉,20,350
槛内人,2023-01-22 20:41:57,哭到口罩湿透。什么视效、剧情、抑郁症都不说了，就冲这个片子敢在大年初一上映，给五星。,50,180
Levana,2023-01-29 20:31:26,"观感：
1.华丽的刑具，在电影院里的俩小时仿佛在上刑。
2.从来不解决根本问题而是幻想着主角被陌生人“拯救”就能重获新生，编剧写剧本的能力永远比不上自我感动的能力，nb。
3.再也不想为国产电影花钱了。",10,229
水水爱喝矿泉水,2023-01-26 17:11:37,简单的把抑郁症定义为灰色，向往生活中的彩色，彩色还是需要被人救赎才能获得，这是对抑郁症的侮辱，求求不要再输出这种肤浅价值观了。大过年恶心人真有你们的，本来视觉污染审美灾难已经让我很不适，没想到最后托底的能是她家人又对她好起来了，爬爬爬，垃圾，消费抑郁还要恶心抑郁，能存做个人！,10,243
尾巴,2023-01-29 20:22:08,让我想起来学生时期有段时间执着于论文字数顶格写，答题卡必须填满，PPT要做极精致漂亮诸如此类表面功夫的时候，至少不会被给差评，但言之无物食之无味，偶尔被评价为“努力”，离“聪明”尚且很远。,30,92
悉卡夫达多,2023-01-28 14:36:13,深海的情绪密度好浓。看电影前买了副3d眼镜，看完送给了检票员，拜托他赠人，他一脸诧异的盯着我。陌生人救了小女孩，为她编了一个童话。我从头哭到尾，不知道为什么我旁边的几个年轻人从头笑到尾，可能我也…我觉得这部电影，就像《四海》，去年《四海》我给了五星，我没把它当电影看，就像是《四海》藏在贺岁档，我笃定选了这部，以至于app提醒，这是您今年看的第一部电影，丧。还好，如我笃信的，丧即真实。可有的人沉溺其中，很痛苦，我是另外有的人，我靠写作。导演那句，散场啦，醒醒吧，让人绷不住。你看得出，这导演在这电影里藏了很多关于绘画，电影，想象的情怀。小女孩挣死往那个梦的世界里钻，我也想去……这么一部脑海中的作品展现于大荧幕，导演一定幸福，我感受的来，比《刺杀小说家》幸福多了啊。最后，敬想象，敬活着，也敬现实。,50,100
墨小沫,2023-01-25 23:27:44,已经准备好在电影院爆哭一顿的我…前面两个小时完全不信，所以后面用音乐音效节奏金句强行煽情的时候，只会觉得更加尴尬。剧情里看到了熟悉的影子，哈尔的移动城堡，千与千寻，少年派，毒液…画面那么漂亮，那么多人费了那么大劲，就讲了个这？最后，全体角色黏糊糊真的很不舒适…,20,147
乐芙莉圣代,2023-01-29 12:57:56,千言万语涌上心头，谢谢你愿意在东亚人追逐的集体主义和宏大叙事之下拥抱我们被禁锢的个体心中的幻梦世界🦋,50,119
慕容复,2023-01-23 13:58:14,好几年没去看院线的动画电影后，再去看本片后真是震惊于国内的动画水平已经高到这个水平了?除了画面外，我觉得这部片子最难得的是适合全年龄的观众去看，对于小朋友来说，这可能是个高配版的小蝌蚪找妈妈。可是对于成年人来说，片中出现的抑郁症、原生家庭和与世界和解的探讨，也是相当戳人的。其实没有想到田晓鹏会在《大圣归来》之后做了这样一部动画，意外也惊喜，他可以做观众想看的，但却做了属于自己的。,50,41
number-wan,2023-01-22 17:27:30,客观4星，感情分5星，这份画面质感就值得二刷，跟同是拍海洋的阿凡达2比都完全不输，还在天马行空的幻想维度上更胜一筹，故事的人文关怀也甩开阿凡达的爹味价值观一大截。缺点仍然在叙事上，桥段重复+视觉轰炸让人有点疲劳，情感的转变也不够流畅合理，堆积到最后才用反转放大招…国产动画的美术和技术水平已经无需证明，真的希望接下来转变为画面服务剧本而不是剧本服务画面。,50,169
朝阳区妻夫木聪,2023-01-23 22:38:06,感受到了影片的勇气和诚意。技术和画面确实无可指摘，美轮美奂，故事最后的落脚点也确实打动了我，看的眼眶湿润了。但最触动我的，反而是全片结束的“快醒醒散场了”六个字，就好像刚刚看片的过程也是做了一个梦，一个有点美好，也有些残酷的梦。在这个梦里，大海是五彩斑斓的，小动物是可爱的，丧气鬼是可以被打跑的，即便是面对跨不过去的坎儿，也还是会被拯救的，是可以重新开始的。但这六个字的出现提醒了你，梦醒了，回到现实里，我们谁又不是参宿呢，只不过我们遇不到属于自己的那个南河罢了。而南河，又何尝不是另一个戴着小丑面具的参宿呢？,40,55
普鲁士蓝,2023-01-22 11:56:52,大年初一首场，真实观影感受：前30min：半小时了还没啥剧情推进；1h：各种炫技，花里胡哨，故事能不能好好讲？1h30min：坚持！马上就完了！最后半小时：BGM太煽情了遭不住遭不住……片尾曲：边哭边回忆剧情，明明可以拍得更好……画面特效音乐都超棒，剧本故事也挺好，但是前半段的观影体验真心不好，可能是年纪大了，不太喜欢单纯炫技的电影（深海传说是导演自己写的……）所以导致很长时间都没有进入剧情，最后的煽情就显得太突兀了……总之，四星还是值得的。,40,158
